-- phpMyAdmin SQL Dump
-- version 5.2.1
-- https://www.phpmyadmin.net/
--
-- Host: 127.0.0.1
-- Generation Time: Nov 13, 2025 at 10:16 AM
-- Server version: 10.4.32-MariaDB
-- PHP Version: 8.2.12

SET SQL_MODE = "NO_AUTO_VALUE_ON_ZERO";
START TRANSACTION;
SET time_zone = "+00:00";


/*!40101 SET @OLD_CHARACTER_SET_CLIENT=@@CHARACTER_SET_CLIENT */;
/*!40101 SET @OLD_CHARACTER_SET_RESULTS=@@CHARACTER_SET_RESULTS */;
/*!40101 SET @OLD_COLLATION_CONNECTION=@@COLLATION_CONNECTION */;
/*!40101 SET NAMES utf8mb4 */;

--
-- Database: `amc`
--

-- --------------------------------------------------------

--
-- Table structure for table `aircraft_details`
--

CREATE TABLE `aircraft_details` (
  `registration` varchar(10) NOT NULL,
  `aircraft_type` varchar(30) DEFAULT NULL,
  `operator_airline` varchar(100) DEFAULT NULL,
  `category` varchar(20) NOT NULL COMMENT 'Commercial, Cargo, Charter',
  `notes` text DEFAULT NULL,
  `updated_at` timestamp NULL DEFAULT current_timestamp() ON UPDATE current_timestamp()
) ENGINE=InnoDB DEFAULT CHARSET=utf8mb4 COLLATE=utf8mb4_unicode_ci;

--
-- Dumping data for table `aircraft_details`
--

INSERT INTO `aircraft_details` (`registration`, `aircraft_type`, `operator_airline`, `category`, `notes`, `updated_at`) VALUES
('13-031', 'DO 328', '', 'charter', NULL, '2025-07-21 14:00:56'),
('13-075', 'DO 328', '', 'charter', NULL, '2025-07-21 14:00:56'),
('13031', 'DO 328', '', 'charter', NULL, '2025-07-21 14:00:56'),
('166-375', 'G V', '', 'charter', NULL, '2025-07-21 14:00:56'),
('18-0093', 'A 400M', '', 'charter', NULL, '2025-07-21 14:00:56'),
('2-TSPP', 'B 738', '', 'charter', NULL, '2025-07-21 14:00:56'),
('20241', 'XIAN Y20 B', '', 'charter', NULL, '2025-07-21 14:00:56'),
('20248', 'XIAN Y20 B', '', 'charter', NULL, '2025-07-21 14:00:56'),
('330-002', 'A 330', '', 'charter', NULL, '2025-07-21 14:00:56'),
('9H-NATHO', 'G VI', '', 'charter', NULL, '2025-07-21 14:00:56'),
('9H-NYC', 'L 1000', '', 'charter', NULL, '2025-07-21 14:00:56'),
('9H-VCB', 'CL 350', '', 'charter', NULL, '2025-07-21 14:00:56'),
('9H-VCC', 'CL 350', '', 'charter', NULL, '2025-07-21 14:00:56'),
('9H-VCE', 'CL 350', '', 'charter', NULL, '2025-07-21 14:00:56'),
('9H-VCR', 'CL 350', '', 'charter', NULL, '2025-07-21 14:00:56'),
('9H-VCZ', 'CL 350', '', 'charter', NULL, '2025-07-21 14:00:56'),
('9H-VFF', 'CL 60', '', 'charter', NULL, '2025-07-21 14:00:56'),
('9H-VIE', 'G 7500', '', 'charter', NULL, '2025-07-21 14:00:56'),
('9H-VIH', 'G 7500', '', 'charter', NULL, '2025-07-21 14:00:56'),
('9H-VIL', 'G 7000', '', 'charter', NULL, '2025-07-21 14:00:56'),
('9H-VIT', 'G 7500', '', 'charter', NULL, '2025-07-21 14:00:56'),
('9H-VJG', 'GLEX', '', 'charter', NULL, '2025-07-21 14:00:56'),
('9H-VJI', 'GLEX', '', 'charter', NULL, '2025-07-21 14:00:56'),
('9M-VEV', 'AVANTI', '', 'charter', NULL, '2025-07-21 14:00:56'),
('A-001', 'BBJ 2', 'TNI AU', 'charter', NULL, '2025-07-21 14:00:56'),
('A-7304', 'B 734', 'TNI AU', 'charter', NULL, '2025-07-21 14:00:56'),
('A-7305', 'B 734', 'TNI AU', 'charter', NULL, '2025-07-21 14:00:56'),
('A-7306', 'B 735', 'TNI AU', 'charter', NULL, '2025-07-21 14:00:56'),
('A-7307', 'B 735', 'TNI AU', 'charter', NULL, '2025-07-21 14:00:56'),
('A-7308', 'B 735', 'TNI AU', 'charter', NULL, '2025-07-21 14:00:56'),
('A-7309', 'B 738', 'TNI AU', 'charter', NULL, '2025-07-21 14:00:56'),
('A2-MBA', 'C 208', '', 'charter', NULL, '2025-07-21 14:00:56'),
('A39-007', 'A 330', '', 'charter', NULL, '2025-07-21 14:00:56'),
('A56-003', 'FAL 7X', '', 'charter', NULL, '2025-07-21 14:00:56'),
('A6-RRJ', 'A 319', '', 'charter', NULL, '2025-07-21 14:00:56'),
('A7-CGG', 'G VI', '', 'charter', NULL, '2025-07-21 14:00:56'),
('A7-CHG', 'G VII', '', 'charter', NULL, '2025-07-21 14:00:56'),
('A7-MHH', 'A 319', '', 'charter', NULL, '2025-07-21 14:00:56'),
('ade', 'setiawan', 'membership', 'Charter', '', '2025-08-31 14:11:15'),
('B-16888', 'CL 60', '', 'charter', NULL, '2025-07-21 14:00:56'),
('B-6738', 'A 320', '', 'charter', NULL, '2025-07-21 14:00:56'),
('B-8125', 'G V', '', 'charter', NULL, '2025-07-21 14:00:56'),
('B-8160', 'G V', '', 'charter', NULL, '2025-07-21 14:00:56'),
('B-8255', 'G V', '', 'charter', NULL, '2025-07-21 14:00:56'),
('B-8309', 'G V', '', 'charter', NULL, '2025-07-21 14:00:56'),
('C-9BAX', 'B 733', '', 'charter', NULL, '2025-07-21 14:00:56'),
('C-FVDH', 'TWIN OTTER', '', 'charter', NULL, '2025-07-21 14:00:56'),
('C-GSGP', 'TWIN OTTER', '', 'charter', NULL, '2025-07-21 14:00:56'),
('CS-GLC', 'GLEX', '', 'charter', NULL, '2025-07-21 14:00:56'),
('EP-IGA', 'A 340', '', 'charter', NULL, '2025-07-21 14:00:56'),
('ER-BYK', 'B 744', '', 'charter', NULL, '2025-07-21 14:00:56'),
('F-HBQT', 'FAL 8X', '', 'charter', NULL, '2025-07-21 14:00:56'),
('F-HGNU', 'ATR 72', '', 'charter', NULL, '2025-07-21 14:00:56'),
('F-RAFA', 'FAL 7X', '', 'charter', NULL, '2025-07-21 14:00:56'),
('F-RAFP', 'FAL 900', '', 'charter', NULL, '2025-07-21 14:00:56'),
('F-XCUH', 'ATLANTIQUE 2', '', 'charter', NULL, '2025-07-21 14:00:56'),
('FNY-5663A', 'CARACAL', '', 'charter', NULL, '2025-07-21 14:00:56'),
('FNY-5663D', 'CARACAL', '', 'charter', NULL, '2025-07-21 14:00:56'),
('HA-5180', 'BELL 412EP', '', 'charter', NULL, '2025-07-21 14:00:56'),
('HB-JKQ', 'G VI', '', 'charter', NULL, '2025-07-21 14:00:56'),
('HL-8299', 'G VI', '', 'charter', NULL, '2025-07-21 14:00:56'),
('HS-KCS', 'CT 750', '', 'charter', NULL, '2025-07-21 14:00:56'),
('M-ARCO', 'G V', '', 'charter', NULL, '2025-07-21 14:00:56'),
('M-ARDI', 'G VI', '', 'charter', NULL, '2025-07-21 14:00:56'),
('M-JGVJ', 'GLEX', '', 'charter', NULL, '2025-07-21 14:00:56'),
('M-PTGG', 'FAL 8X', '', 'charter', NULL, '2025-07-21 14:00:56'),
('N-110H', 'C 208', '', 'charter', NULL, '2025-07-21 14:00:56'),
('N-118CY', 'DA 62', '', 'charter', NULL, '2025-07-21 14:00:56'),
('N-11UB', 'GLEX', '', 'charter', NULL, '2025-07-21 14:00:56'),
('N-171GA', 'G 700', '', 'charter', NULL, '2025-07-21 14:00:56'),
('N-198RL', 'G V', 'TRAVIRA', 'charter', NULL, '2025-07-21 14:00:56'),
('N-204DD', 'G 200', '', 'charter', NULL, '2025-07-21 14:00:56'),
('N-227GV', 'L 1000', 'PREMI', 'charter', NULL, '2025-07-21 14:00:56'),
('N-2409K', 'HK 800', '', 'charter', NULL, '2025-07-21 14:00:56'),
('N-308KB', 'G 280', '', 'charter', NULL, '2025-07-21 14:00:56'),
('N-308KG', 'G V', '', 'charter', NULL, '2025-07-21 14:00:56'),
('N-38SV', 'LJ 60', '', 'charter', NULL, '2025-07-21 14:00:56'),
('N-440QS', 'G IV', '', 'charter', NULL, '2025-07-21 14:00:56'),
('N-45AY', 'CT 680', '', 'charter', NULL, '2025-07-21 14:00:56'),
('N-484BA', 'LJ 31', 'IAP', 'charter', NULL, '2025-07-21 14:00:56'),
('N-61WC', 'AVANTI', '', 'charter', NULL, '2025-07-21 14:00:56'),
('N-61WX', 'G VI', '', 'charter', NULL, '2025-07-21 14:00:56'),
('N-61WZ', 'G V', '', 'charter', NULL, '2025-07-21 14:00:56'),
('N-69HY', 'CT 525', '', 'charter', NULL, '2025-07-21 14:00:56'),
('N-705HM', 'G 500', '', 'charter', NULL, '2025-07-21 14:00:56'),
('N-777ZH', 'G VI', '', 'charter', NULL, '2025-07-21 14:00:56'),
('N-779LG', 'CL 60', '', 'charter', NULL, '2025-07-21 14:00:56'),
('N-810CK', 'GLEX', '', 'charter', NULL, '2025-07-21 14:00:56'),
('N-887WM', 'G VI', '', 'charter', NULL, '2025-07-21 14:00:56'),
('N-889ST', 'G7500', '', 'charter', NULL, '2025-07-21 14:00:56'),
('N-902CL', 'CT 700', '', 'charter', NULL, '2025-07-21 14:00:56'),
('N-91GT', 'CT 525', '', 'charter', NULL, '2025-07-21 14:00:56'),
('N-939AP', 'GLEX', 'BIOMANTARA', 'charter', NULL, '2025-07-21 14:00:56'),
('N-939GS', 'GLEX', 'BIOMANTARA', 'charter', NULL, '2025-07-21 14:00:56'),
('N-939SG', 'G VI', 'BIOMANTARA', 'charter', NULL, '2025-07-21 14:00:56'),
('N-954JJ', 'GLEX', '', 'charter', NULL, '2025-07-21 14:00:56'),
('N-9688R', 'PH 300', '', 'charter', NULL, '2025-07-21 14:00:56'),
('N-970NX', 'GLEX', 'PREMI', 'charter', NULL, '2025-07-21 14:00:56'),
('N-977HS', 'G V', '', 'charter', NULL, '2025-07-21 14:00:56'),
('N-977JH', 'CT 680', 'JIP', 'charter', NULL, '2025-07-21 14:00:56'),
('P-3102', 'AS 365', 'POLICE', 'charter', NULL, '2025-07-21 14:00:56'),
('P-3306', 'AW 169', '', 'charter', NULL, '2025-07-21 14:00:56'),
('P-3309', 'AW 169', 'POLICE', 'charter', NULL, '2025-07-21 14:00:56'),
('P-4301', 'BE 1900', 'POLICE', 'charter', NULL, '2025-07-21 14:00:56'),
('P-4501', 'CN 295', 'POLICE', 'charter', NULL, '2025-07-21 14:00:56'),
('P-7001', 'AW 189', '', 'charter', NULL, '2025-07-21 14:00:56'),
('P-7301', 'B 738', 'POLICE', 'charter', NULL, '2025-07-21 14:00:56'),
('P-8304', 'CN 235', '', 'charter', NULL, '2025-07-21 14:00:56'),
('P4-AL9', 'CL 850', '', 'charter', NULL, '2025-07-21 14:00:56'),
('PK-BBJ', 'B 734', 'B. B. N.', 'charter', NULL, '2025-07-21 14:00:56'),
('PK-BBN', 'B 738', 'B. B. N', 'charter', NULL, '2025-07-21 14:00:56'),
('PK-BGF', 'A 320', 'BATIK AIR', 'commercial', NULL, '2025-07-21 14:00:56'),
('PK-BKA', 'A 320', 'BATIK AIR', 'commercial', NULL, '2025-07-21 14:00:56'),
('PK-BKB', 'A 320', 'BATIK AIR', 'commercial', NULL, '2025-07-21 14:00:56'),
('PK-BKC', 'A 320', 'BATIK AIR', 'commercial', NULL, '2025-07-21 14:00:56'),
('PK-BKD', 'A 320', 'BATIK AIR', 'commercial', NULL, '2025-07-21 14:00:56'),
('PK-BKE', 'A 320', 'BATIK AIR', 'commercial', NULL, '2025-07-21 14:00:56'),
('PK-BKF', 'A 320', 'BATIK AIR', 'commercial', NULL, '2025-07-21 14:00:56'),
('PK-BKG', 'A 320', 'BATIK AIR', 'commercial', NULL, '2025-07-21 14:00:56'),
('PK-BKH', 'A 320', 'BATIK AIR', 'commercial', NULL, '2025-07-21 14:00:56'),
('PK-BKI', 'A 320', 'BATIK AIR', 'commercial', NULL, '2025-07-21 14:00:56'),
('PK-BKJ', 'A 320', 'BATIK AIR', 'commercial', NULL, '2025-07-21 14:00:56'),
('PK-BKK', 'A 320', 'BATIK AIR', 'commercial', NULL, '2025-07-21 14:00:56'),
('PK-BKL', 'A 320', 'BATIK AIR', 'commercial', NULL, '2025-07-21 14:00:56'),
('PK-BKM', 'A 320', 'BATIK AIR', 'commercial', NULL, '2025-07-21 14:00:56'),
('PK-BKN', 'A 320', 'BATIK AIR', 'commercial', NULL, '2025-07-21 14:00:56'),
('PK-BKO', 'A 320', 'BATIK AIR', 'commercial', NULL, '2025-07-21 14:00:56'),
('PK-BKP', 'A 320', 'BATIK AIR', 'commercial', NULL, '2025-07-21 14:00:56'),
('PK-BKQ', 'A 320', 'BATIK AIR', 'commercial', NULL, '2025-07-21 14:00:56'),
('PK-BKR', 'A 320', 'BATIK AIR', 'commercial', NULL, '2025-07-21 14:00:56'),
('PK-BKS', 'A 320', 'BATIK AIR', 'commercial', NULL, '2025-07-21 14:00:56'),
('PK-BKT', 'A 320', 'BATIK AIR', 'commercial', NULL, '2025-07-21 14:00:56'),
('PK-BKU', 'A 320', 'BATIK AIR', 'commercial', NULL, '2025-07-21 14:00:56'),
('PK-BKV', 'A 320', 'BATIK AIR', 'commercial', NULL, '2025-07-21 14:00:56'),
('PK-BKW', 'A 320', 'BATIK AIR', 'commercial', NULL, '2025-07-21 14:00:56'),
('PK-BKX', 'A 320', 'BATIK AIR', 'commercial', NULL, '2025-07-21 14:00:56'),
('PK-BKY', 'A 320', 'BATIK AIR', 'commercial', NULL, '2025-07-21 14:00:56'),
('PK-BKZ', 'A 320', 'BATIK AIR', 'commercial', NULL, '2025-07-21 14:00:56'),
('PK-BLA', 'A 320', 'BATIK AIR', 'commercial', NULL, '2025-07-21 14:00:56'),
('PK-BLB', 'A 320', 'BATIK AIR', 'commercial', NULL, '2025-07-21 14:00:56'),
('PK-BLC', 'A 320', 'BATIK AIR', 'commercial', NULL, '2025-07-21 14:00:56'),
('PK-BLD', 'A 320', 'BATIK AIR', 'commercial', NULL, '2025-07-21 14:00:56'),
('PK-BLE', 'A 320', 'BATIK AIR', 'commercial', NULL, '2025-07-21 14:00:56'),
('PK-BLF', 'A 320', 'BATIK AIR', 'commercial', NULL, '2025-07-21 14:00:56'),
('PK-BLG', 'A 320', 'BATIK AIR', 'commercial', NULL, '2025-07-21 14:00:56'),
('PK-BLH', 'A 320', 'BATIK AIR', 'commercial', NULL, '2025-07-21 14:00:56'),
('PK-BLI', 'A 320', 'BATIK AIR', 'commercial', NULL, '2025-07-21 14:00:56'),
('PK-BLJ', 'A 320', 'BATIK AIR', 'commercial', NULL, '2025-07-21 14:00:56'),
('PK-BLK', 'A 320', 'BATIK AIR', 'commercial', NULL, '2025-07-21 14:00:56'),
('PK-BLL', 'A 320', 'BATIK AIR', 'commercial', NULL, '2025-07-21 14:00:56'),
('PK-BLM', 'A 320', 'BATIK AIR', 'commercial', NULL, '2025-07-21 14:00:56'),
('PK-BLN', 'A 320', 'BATIK AIR', 'commercial', NULL, '2025-07-21 14:00:56'),
('PK-BLO', 'A 320', 'BATIK AIR', 'commercial', NULL, '2025-07-21 14:00:56'),
('PK-BLP', 'A 320', 'BATIK AIR', 'commercial', NULL, '2025-07-21 14:00:56'),
('PK-BLQ', 'A 320', 'BATIK AIR', 'commercial', NULL, '2025-07-21 14:00:56'),
('PK-BLR', 'A 320', 'BATIK AIR', 'commercial', NULL, '2025-07-21 14:00:56'),
('PK-BLS', 'A 320', 'BATIK AIR', 'commercial', NULL, '2025-07-21 14:00:56'),
('PK-BLT', 'A 320', 'BATIK AIR', 'commercial', NULL, '2025-07-21 14:00:56'),
('PK-BLU', 'A 320', 'BATIK AIR', 'commercial', NULL, '2025-07-21 14:00:56'),
('PK-BLV', 'A 320', 'BATIK AIR', 'commercial', NULL, '2025-07-21 14:00:56'),
('PK-BLW', 'A 320', 'BATIK AIR', 'commercial', NULL, '2025-07-21 14:00:56'),
('PK-BLX', 'A 320', 'BATIK AIR', 'commercial', NULL, '2025-07-21 14:00:56'),
('PK-BLY', 'A 320', 'BATIK AIR', 'commercial', NULL, '2025-07-21 14:00:56'),
('PK-BLZ', 'A 320', 'BATIK AIR', 'commercial', NULL, '2025-07-21 14:00:56'),
('PK-BMB', 'EMB 135', '', 'charter', NULL, '2025-07-21 14:00:56'),
('PK-BON', 'G IV', 'JETSET', 'charter', NULL, '2025-07-21 14:00:56'),
('PK-BVB', 'C 208', 'SUSI AIR', 'commercial', NULL, '2025-07-21 14:00:56'),
('PK-BVN', 'C 208', 'SUSI AIR', 'commercial', NULL, '2025-07-21 14:00:56'),
('PK-BVO', 'AVANTI', 'SUSI AIR', 'commercial', NULL, '2025-07-21 14:00:56'),
('PK-BVV', 'AVANTI', 'SUSI AIR', 'commercial', NULL, '2025-07-21 14:00:56'),
('PK-BVX', 'AVANTI', 'SUSI AIR', 'Komersial', NULL, '2025-10-26 06:25:20'),
('PK-CAA', 'CT 700', '', 'charter', NULL, '2025-07-21 14:00:56'),
('PK-CAN', 'KING AIR', 'DEPHUB', 'charter', NULL, '2025-07-21 14:00:56'),
('PK-CAQ', 'KING AIR', '', 'charter', NULL, '2025-07-21 14:00:56'),
('PK-CAR', 'HK 900', '', 'charter', NULL, '2025-07-21 14:00:56'),
('PK-CEO', 'HK 800', 'JETSET', 'charter', NULL, '2025-07-21 14:00:56'),
('PK-DAM', 'AS 350', 'DERAZONA', 'charter', NULL, '2025-07-21 14:00:56'),
('PK-DAP', 'AS 350', 'DERAZONA', 'charter', NULL, '2025-07-21 14:00:56'),
('PK-DAR', 'BELL 412', 'DERAZONA', 'charter', NULL, '2025-07-21 14:00:56'),
('PK-DAS', 'BELL 412', 'DERAZONA', 'charter', NULL, '2025-07-21 14:00:56'),
('PK-DGC', 'BAE ATP', 'DERAYA', 'charter', NULL, '2025-07-21 14:00:56'),
('PK-DJH', 'AW 169', '', 'charter', NULL, '2025-07-21 14:00:56'),
('PK-DJM', 'AW 169', '', 'charter', NULL, '2025-07-21 14:00:56'),
('PK-DJR', 'AW 169', '', 'charter', NULL, '2025-07-21 14:00:56'),
('PK-DJV', 'HK 900', '', 'charter', NULL, '2025-07-21 14:00:56'),
('PK-DPI', 'C 208', '', 'charter', NULL, '2025-07-21 14:00:56'),
('PK-DPR', 'EC 145', '', 'charter', NULL, '2025-07-21 14:00:56'),
('PK-FGG', 'EC 45', 'SURYA AIR', 'charter', NULL, '2025-07-21 14:00:56'),
('PK-FGS', 'BK 117', '', 'charter', NULL, '2025-07-21 14:00:56'),
('PK-FGT', 'EC 155', '', 'charter', NULL, '2025-07-21 14:00:56'),
('PK-GE ER D', 'G5', 'SUSI', 'Commercial', '', '2025-09-07 07:08:28'),
('PK-GFA', 'B 738', 'GARUDA', 'Komersial', NULL, '2025-10-26 06:31:41'),
('PK-GFC', 'B 738', 'GARUDA', 'commercial', NULL, '2025-07-21 14:00:56'),
('PK-GFD', 'B 738', 'GARUDA', 'commercial', NULL, '2025-07-21 14:00:56'),
('PK-GFE', 'B 738', 'GARUDA', 'commercial', NULL, '2025-07-21 14:00:56'),
('PK-GFF', 'B 738', 'GARUDA', 'commercial', NULL, '2025-07-21 14:00:56'),
('PK-GFG', 'B 738', 'GARUDA', 'commercial', NULL, '2025-07-21 14:00:56'),
('PK-GFH', 'B 738', 'GARUDA', 'commercial', NULL, '2025-07-21 14:00:56'),
('PK-GFI', 'B 738', 'GARUDA', 'commercial', NULL, '2025-07-21 14:00:56'),
('PK-GFJ', 'B 738', 'GARUDA', 'commercial', NULL, '2025-07-21 14:00:56'),
('PK-GFK', 'B 738', 'GARUDA', 'commercial', NULL, '2025-07-21 14:00:56'),
('PK-GFL', 'B 738', 'GARUDA', 'commercial', NULL, '2025-07-21 14:00:56'),
('PK-GFM', 'B 738', 'GARUDA', 'Komersial', NULL, '2025-10-26 06:29:49'),
('PK-GFN', 'B 738', 'GARUDA', 'commercial', NULL, '2025-07-21 14:00:56'),
('PK-GFO', 'B 738', 'GARUDA', 'commercial', NULL, '2025-07-21 14:00:56'),
('PK-GFP', 'B 738', 'GARUDA', 'commercial', NULL, '2025-07-21 14:00:56'),
('PK-GFQ', 'B 738', 'GARUDA', 'commercial', NULL, '2025-07-21 14:00:56'),
('PK-GFR', 'B 738', 'GARUDA', 'commercial', NULL, '2025-07-21 14:00:56'),
('PK-GFS', 'B 738', 'GARUDA', 'commercial', NULL, '2025-07-21 14:00:56'),
('PK-GFT', 'B 738', 'GARUDA', 'commercial', NULL, '2025-07-21 14:00:56'),
('PK-GFU', 'B 738', 'GARUDA', 'commercial', NULL, '2025-07-21 14:00:56'),
('PK-GFV', 'B 738', 'GARUDA', 'commercial', NULL, '2025-07-21 14:00:56'),
('PK-GFW', 'B 738', 'GARUDA', 'commercial', NULL, '2025-07-21 14:00:56'),
('PK-GFX', 'B 738', 'GARUDA', 'commercial', NULL, '2025-07-21 14:00:56'),
('PK-GFY', 'B 738', 'GARUDA', 'commercial', NULL, '2025-07-21 14:00:56'),
('PK-GJQ', 'ATR 72', 'CITILINK', 'commercial', NULL, '2025-07-21 14:00:56'),
('PK-GJT', 'ATR 72', 'CITILINK', 'commercial', NULL, '2025-07-21 14:00:56'),
('PK-GJV', 'ATR 72', 'CITILINK', 'commercial', NULL, '2025-07-21 14:00:56'),
('PK-GLA', 'A 320', 'CITILINK', 'commercial', NULL, '2025-07-21 14:00:56'),
('PK-GLC', 'A 320', 'CITILINK', 'commercial', NULL, '2025-07-21 14:00:56'),
('PK-GLD', 'A 320', 'CITILINK', 'commercial', NULL, '2025-07-21 14:00:56'),
('PK-GLE', 'A 320', 'CITILINK', 'commercial', NULL, '2025-07-21 14:00:56'),
('PK-GLF', 'A 320', 'CITILINK', 'commercial', NULL, '2025-07-21 14:00:56'),
('PK-GLG', 'A 320', 'CITILINK', 'commercial', NULL, '2025-07-21 14:00:56'),
('PK-GLH', 'A 320', 'CITILINK', 'commercial', NULL, '2025-07-21 14:00:56'),
('PK-GLI', 'A 320', 'CITILINK', 'commercial', NULL, '2025-07-21 14:00:56'),
('PK-GLJ', 'A 320', 'CITILINK', 'commercial', NULL, '2025-07-21 14:00:56'),
('PK-GLK', 'A 320', 'CITILINK', 'commercial', NULL, '2025-07-21 14:00:56'),
('PK-GLL', 'A 320', 'CITILINK', 'commercial', NULL, '2025-07-21 14:00:56'),
('PK-GLM', 'A 320', 'CITILINK', 'commercial', NULL, '2025-07-21 14:00:56'),
('PK-GLN', 'A 320', 'CITILINK', 'commercial', NULL, '2025-07-21 14:00:56'),
('PK-GLO', 'A 320', 'CITILINK', 'commercial', NULL, '2025-07-21 14:00:56'),
('PK-GLP', 'A 320', 'CITILINK', 'commercial', NULL, '2025-07-21 14:00:56'),
('PK-GLQ', 'A 320', 'CITILINK', 'commercial', NULL, '2025-07-21 14:00:56'),
('PK-GLR', 'A 320', 'CITILINK', 'commercial', NULL, '2025-07-21 14:00:56'),
('PK-GLS', 'A 320', 'CITILINK', 'commercial', NULL, '2025-07-21 14:00:56'),
('PK-GLT', 'A 320', 'CITILINK', 'commercial', NULL, '2025-07-21 14:00:56'),
('PK-GLU', 'A 320', 'CITILINK', 'commercial', NULL, '2025-07-21 14:00:56'),
('PK-GLV', 'A 320', 'CITILINK', 'commercial', NULL, '2025-07-21 14:00:56'),
('PK-GLW', 'A 320', 'CITILINK', 'commercial', NULL, '2025-07-21 14:00:56'),
('PK-GLX', 'A 320', 'CITILINK', 'commercial', NULL, '2025-07-21 14:00:56'),
('PK-GLY', 'A 320', 'CITILINK', 'commercial', NULL, '2025-07-21 14:00:56'),
('PK-GLZ', 'A 320', 'CITILINK', 'commercial', NULL, '2025-07-21 14:00:56'),
('PK-GMA', 'B 738', 'GARUDA', 'commercial', NULL, '2025-07-21 14:00:56'),
('PK-GMC', 'B 738', 'GARUDA', 'commercial', NULL, '2025-07-21 14:00:56'),
('PK-GMD', 'B 738', 'GARUDA', 'commercial', NULL, '2025-07-21 14:00:56'),
('PK-GME', 'B 738', 'GARUDA', 'commercial', NULL, '2025-07-21 14:00:56'),
('PK-GMF', 'B 738', 'GARUDA', 'commercial', NULL, '2025-07-21 14:00:56'),
('PK-GMG', 'B 738', 'GARUDA', 'commercial', NULL, '2025-07-21 14:00:56'),
('PK-GMH', 'B 738', 'GARUDA', 'commercial', NULL, '2025-07-21 14:00:56'),
('PK-GMI', 'B 738', 'GARUDA', 'commercial', NULL, '2025-07-21 14:00:56'),
('PK-GMJ', 'B 738', 'GARUDA', 'commercial', NULL, '2025-07-21 14:00:56'),
('PK-GMK', 'B 738', 'GARUDA', 'commercial', NULL, '2025-07-21 14:00:56'),
('PK-GML', 'B 738', 'GARUDA', 'commercial', NULL, '2025-07-21 14:00:56'),
('PK-GMM', 'B 738', 'GARUDA', 'commercial', NULL, '2025-07-21 14:00:56'),
('PK-GMN', 'B 738', 'GARUDA', 'commercial', NULL, '2025-07-21 14:00:56'),
('PK-GMO', 'B 738', 'GARUDA', 'commercial', NULL, '2025-07-21 14:00:56'),
('PK-GMP', 'B 738', 'GARUDA', 'commercial', NULL, '2025-07-21 14:00:56'),
('PK-GMQ', 'B 738', 'GARUDA', 'commercial', NULL, '2025-07-21 14:00:56'),
('PK-GMR', 'B 738', 'GARUDA', 'commercial', NULL, '2025-07-21 14:00:56'),
('PK-GMS', 'B 738', 'GARUDA', 'commercial', NULL, '2025-07-21 14:00:56'),
('PK-GMT', 'B 738', 'GARUDA', 'commercial', NULL, '2025-07-21 14:00:56'),
('PK-GMU', 'B 738', 'GARUDA', 'commercial', NULL, '2025-07-21 14:00:56'),
('PK-GMV', 'B 738', 'GARUDA', 'commercial', NULL, '2025-07-21 14:00:56'),
('PK-GMW', 'B 738', 'GARUDA', 'commercial', NULL, '2025-07-21 14:00:56'),
('PK-GMX', 'B 738', 'GARUDA', 'commercial', NULL, '2025-07-21 14:00:56'),
('PK-GMY', 'B 738', 'GARUDA', 'commercial', NULL, '2025-07-21 14:00:56'),
('PK-GMZ', 'B 738', 'GARUDA', 'commercial', NULL, '2025-07-21 14:00:56'),
('PK-GNA', 'B 738', 'GARUDA', 'commercial', NULL, '2025-07-21 14:00:56'),
('PK-GNC', 'B 738', 'GARUDA', 'commercial', NULL, '2025-07-21 14:00:56'),
('PK-GND', 'B 738', 'GARUDA', 'commercial', NULL, '2025-07-21 14:00:56'),
('PK-GNE', 'B 738', 'GARUDA', 'commercial', NULL, '2025-07-21 14:00:56'),
('PK-GNF', 'B 738', 'GARUDA', 'commercial', NULL, '2025-07-21 14:00:56'),
('PK-GNG', 'B 738', 'GARUDA', 'commercial', NULL, '2025-07-21 14:00:56'),
('PK-GNH', 'B 738', 'GARUDA', 'commercial', NULL, '2025-07-21 14:00:56'),
('PK-GNI', 'B 738', 'GARUDA', 'commercial', NULL, '2025-07-21 14:00:56'),
('PK-GNJ', 'B 738', 'GARUDA', 'commercial', NULL, '2025-07-21 14:00:56'),
('PK-GNK', 'B 738', 'GARUDA', 'commercial', NULL, '2025-07-21 14:00:56'),
('PK-GNL', 'B 738', 'GARUDA', 'commercial', NULL, '2025-07-21 14:00:56'),
('PK-GNM', 'B 738', 'GARUDA', 'commercial', NULL, '2025-07-21 14:00:56'),
('PK-GNN', 'B 738', 'GARUDA', 'commercial', NULL, '2025-07-21 14:00:56'),
('PK-GNO', 'B 738', 'GARUDA', 'commercial', NULL, '2025-07-21 14:00:56'),
('PK-GNP', 'B 738', 'GARUDA', 'commercial', NULL, '2025-07-21 14:00:56'),
('PK-GNQ', 'B 738', 'GARUDA', 'commercial', NULL, '2025-07-21 14:00:56'),
('PK-GNR', 'B 738', 'GARUDA', 'commercial', NULL, '2025-07-21 14:00:56'),
('PK-GNS', 'B 738', 'GARUDA', 'commercial', NULL, '2025-07-21 14:00:56'),
('PK-GNT', 'B 738', 'GARUDA', 'commercial', NULL, '2025-07-21 14:00:56'),
('PK-GNU', 'B 738', 'GARUDA', 'commercial', NULL, '2025-07-21 14:00:56'),
('PK-GNV', 'B 738', 'GARUDA', 'commercial', NULL, '2025-07-21 14:00:56'),
('PK-GNW', 'B 738', 'GARUDA', 'commercial', NULL, '2025-07-21 14:00:56'),
('PK-GNX', 'B 738', 'GARUDA', 'commercial', NULL, '2025-07-21 14:00:56'),
('PK-GNY', 'B 738', 'GARUDA', 'commercial', NULL, '2025-07-21 14:00:56'),
('PK-GNZ', 'B 738', 'GARUDA', 'commercial', NULL, '2025-07-21 14:00:56'),
('PK-GQA', 'A 320', 'CITILINK', 'commercial', NULL, '2025-07-21 14:00:56'),
('PK-GQC', 'A 320', 'CITILINK', 'commercial', NULL, '2025-07-21 14:00:56'),
('PK-GQD', 'A 320', 'CITILINK', 'commercial', NULL, '2025-07-21 14:00:56'),
('PK-GQE', 'A 320', 'CITILINK', 'commercial', NULL, '2025-07-21 14:00:56'),
('PK-GQF', 'A 320', 'CITILINK', 'commercial', NULL, '2025-07-21 14:00:56'),
('PK-GQG', 'A 320', 'CITILINK', 'commercial', NULL, '2025-07-21 14:00:56'),
('PK-GQH', 'A 320', 'CITILINK', 'commercial', NULL, '2025-07-21 14:00:56'),
('PK-GQI', 'A 320', 'CITILINK', 'commercial', NULL, '2025-07-21 14:00:56'),
('PK-GQJ', 'A 320', 'CITILINK', 'commercial', NULL, '2025-07-21 14:00:56'),
('PK-GQK', 'A 320', 'CITILINK', 'commercial', NULL, '2025-07-21 14:00:56'),
('PK-GQL', 'A 320', 'CITILINK', 'commercial', NULL, '2025-07-21 14:00:56'),
('PK-GQM', 'A 320', 'CITILINK', 'commercial', NULL, '2025-07-21 14:00:56'),
('PK-GQN', 'A 320', 'CITILINK', 'commercial', NULL, '2025-07-21 14:00:56'),
('PK-GQO', 'A 320', 'CITILINK', 'commercial', NULL, '2025-07-21 14:00:56'),
('PK-GQP', 'A 320', 'CITILINK', 'commercial', NULL, '2025-07-21 14:00:56'),
('PK-GQQ', 'A 320', 'CITILINK', 'commercial', NULL, '2025-07-21 14:00:56'),
('PK-GQR', 'A 320', 'CITILINK', 'commercial', NULL, '2025-07-21 14:00:56'),
('PK-GQS', 'A 320', 'CITILINK', 'commercial', NULL, '2025-07-21 14:00:56'),
('PK-GQT', 'A 320', 'CITILINK', 'commercial', NULL, '2025-07-21 14:00:56'),
('PK-GQU', 'A 320', 'CITILINK', 'commercial', NULL, '2025-07-21 14:00:56'),
('PK-GQV', 'A 320', 'CITILINK', 'commercial', NULL, '2025-07-21 14:00:56'),
('PK-GQW', 'A 320', 'CITILINK', 'commercial', NULL, '2025-07-21 14:00:56'),
('PK-GQX', 'A 320', 'CITILINK', 'commercial', NULL, '2025-07-21 14:00:56'),
('PK-GQY', 'A 320', 'CITILINK', 'commercial', NULL, '2025-07-21 14:00:56'),
('PK-GQZ', 'A 320', 'CITILINK', 'commercial', NULL, '2025-07-21 14:00:56'),
('PK-GRD', 'BBJ 2', 'PTN', 'charter', NULL, '2025-07-21 14:00:56'),
('PK-GSA', 'C 208', '', 'charter', NULL, '2025-07-21 14:00:56'),
('PK-GTA', 'A 320', 'CITILINK', 'commercial', NULL, '2025-07-21 14:00:56'),
('PK-GTC', 'A 320', 'CITILINK', 'commercial', NULL, '2025-07-21 14:00:56'),
('PK-GTD', 'A 320', 'CITILINK', 'commercial', NULL, '2025-07-21 14:00:56'),
('PK-GTE', 'A 320', 'CITILINK', 'commercial', NULL, '2025-07-21 14:00:56'),
('PK-GTF', 'A 320', 'CITILINK', 'commercial', NULL, '2025-07-21 14:00:56'),
('PK-GTG', 'A 320', 'CITILINK', 'commercial', NULL, '2025-07-21 14:00:56'),
('PK-GTH', 'A 320', 'CITILINK', 'commercial', NULL, '2025-07-21 14:00:56'),
('PK-GTI', 'A 320', 'CITILINK', 'commercial', NULL, '2025-07-21 14:00:56'),
('PK-GTJ', 'A 320', 'CITILINK', 'commercial', NULL, '2025-07-21 14:00:56'),
('PK-GTK', 'A 320', 'CITILINK', 'commercial', NULL, '2025-07-21 14:00:56'),
('PK-GTL', 'A 320', 'CITILINK', 'commercial', NULL, '2025-07-21 14:00:56'),
('PK-GTM', 'A 320', 'CITILINK', 'commercial', NULL, '2025-07-21 14:00:56'),
('PK-GTN', 'A 320', 'CITILINK', 'commercial', NULL, '2025-07-21 14:00:56'),
('PK-GTO', 'A 320', 'CITILINK', 'commercial', NULL, '2025-07-21 14:00:56'),
('PK-GTP', 'A 320', 'CITILINK', 'commercial', NULL, '2025-07-21 14:00:56'),
('PK-GTQ', 'A 320', 'CITILINK', 'commercial', NULL, '2025-07-21 14:00:56'),
('PK-GTR', 'A 320', 'CITILINK', 'commercial', NULL, '2025-07-21 14:00:56'),
('PK-GTS', 'A 320', 'CITILINK', 'commercial', NULL, '2025-07-21 14:00:56'),
('PK-GTT', 'A 320', 'CITILINK', 'commercial', NULL, '2025-07-21 14:00:56'),
('PK-GTU', 'A 320', 'CITILINK', 'commercial', NULL, '2025-07-21 14:00:56'),
('PK-GTV', 'A 320', 'CITILINK', 'commercial', NULL, '2025-07-21 14:00:56'),
('PK-GTW', 'A 320', 'CITILINK', 'commercial', NULL, '2025-07-21 14:00:56'),
('PK-GTX', 'A 320', 'CITILINK', 'commercial', NULL, '2025-07-21 14:00:56'),
('PK-GTY', 'A 320', 'CITILINK', 'commercial', NULL, '2025-07-21 14:00:56'),
('PK-GTZ', 'A 320', 'CITILINK', 'commercial', NULL, '2025-07-21 14:00:56'),
('PK-GUA', 'B 738', 'GARUDA', 'commercial', NULL, '2025-07-21 14:00:56'),
('PK-GUC', 'B 738', 'GARUDA', 'commercial', NULL, '2025-07-21 14:00:56'),
('PK-GUD', 'B 738', 'GARUDA', 'commercial', NULL, '2025-07-21 14:00:56'),
('PK-GUE', 'B 738', 'GARUDA', 'commercial', NULL, '2025-07-21 14:00:56'),
('PK-GUF', 'B 738', 'GARUDA', 'commercial', NULL, '2025-07-21 14:00:56'),
('PK-GUG', 'B 738', 'GARUDA', 'commercial', NULL, '2025-07-21 14:00:56'),
('PK-GUH', 'B 738', 'GARUDA', 'commercial', NULL, '2025-07-21 14:00:56'),
('PK-GUI', 'B 738', 'GARUDA', 'commercial', NULL, '2025-07-21 14:00:56'),
('PK-GUJ', 'B 738', 'GARUDA', 'commercial', NULL, '2025-07-21 14:00:56'),
('PK-GUK', 'B 738', 'GARUDA', 'commercial', NULL, '2025-07-21 14:00:56'),
('PK-GUL', 'B 738', 'GARUDA', 'commercial', NULL, '2025-07-21 14:00:56'),
('PK-GUM', 'B 738', 'GARUDA', 'commercial', NULL, '2025-07-21 14:00:56'),
('PK-GUN', 'B 738', 'GARUDA', 'commercial', NULL, '2025-07-21 14:00:56'),
('PK-GUO', 'B 738', 'GARUDA', 'commercial', NULL, '2025-07-21 14:00:56'),
('PK-GUP', 'B 738', 'GARUDA', 'commercial', NULL, '2025-07-21 14:00:56'),
('PK-GUQ', 'B 738', 'GARUDA', 'commercial', NULL, '2025-07-21 14:00:56'),
('PK-GUR', 'B 738', 'GARUDA', 'commercial', NULL, '2025-07-21 14:00:56'),
('PK-GUS', 'B 738', 'GARUDA', 'commercial', NULL, '2025-07-21 14:00:56'),
('PK-GUT', 'B 738', 'GARUDA', 'commercial', NULL, '2025-07-21 14:00:56'),
('PK-GUU', 'B 738', 'GARUDA', 'commercial', NULL, '2025-07-21 14:00:56'),
('PK-GUV', 'B 738', 'GARUDA', 'commercial', NULL, '2025-07-21 14:00:56'),
('PK-GUW', 'B 738', 'GARUDA', 'commercial', NULL, '2025-07-21 14:00:56'),
('PK-GUX', 'B 738', 'GARUDA', 'commercial', NULL, '2025-07-21 14:00:56'),
('PK-GUY', 'B 738', 'GARUDA', 'commercial', NULL, '2025-07-21 14:00:56'),
('PK-GUZ', 'B 738', 'GARUDA', 'commercial', NULL, '2025-07-21 14:00:56'),
('PK-IDR', 'CL 850', '', 'charter', NULL, '2025-07-21 14:00:56'),
('PK-JBK', 'KING AIR', '', 'charter', NULL, '2025-07-21 14:00:56'),
('PK-JBP', 'KING AIR', '', 'charter', NULL, '2025-07-21 14:00:56'),
('PK-JCO', 'PH 300', 'PURAWISATA', 'charter', NULL, '2025-07-21 14:00:56'),
('PK-JRB', 'B 733', 'JAYAWIJAYA', 'Cargo', NULL, '2025-10-26 06:22:59'),
('PK-JTO', 'EC 130', '', 'charter', NULL, '2025-07-21 14:00:56'),
('PK-JTX', 'BELL 407', 'AIR PASIFIC', 'charter', NULL, '2025-07-21 14:00:56'),
('PK-KAS', 'CL 850', 'JETSET', 'Charter', NULL, '2025-10-26 06:17:35'),
('PK-LAA', 'A 320', 'BATIK AIR', 'commercial', NULL, '2025-07-21 14:00:56'),
('PK-LAB', 'A 320', 'BATIK AIR', 'commercial', NULL, '2025-07-21 14:00:56'),
('PK-LAC', 'A 320', 'BATIK AIR', 'commercial', NULL, '2025-07-21 14:00:56'),
('PK-LAD', 'A 320', 'BATIK AIR', 'commercial', NULL, '2025-07-21 14:00:56'),
('PK-LAE', 'A 320', 'BATIK AIR', 'commercial', NULL, '2025-07-21 14:00:56'),
('PK-LAF', 'A 320', 'BATIK AIR', 'commercial', NULL, '2025-07-21 14:00:56'),
('PK-LAG', 'A 320', 'BATIK AIR', 'commercial', NULL, '2025-07-21 14:00:56'),
('PK-LAH', 'A 320', 'BATIK AIR', 'commercial', NULL, '2025-07-21 14:00:56'),
('PK-LAI', 'A 320', 'BATIK AIR', 'commercial', NULL, '2025-07-21 14:00:56'),
('PK-LAJ', 'A 320', 'BATIK AIR', 'commercial', NULL, '2025-07-21 14:00:56'),
('PK-LAK', 'A 320', 'BATIK AIR', 'commercial', NULL, '2025-07-21 14:00:56'),
('PK-LAL', 'A 320', 'BATIK AIR', 'commercial', NULL, '2025-07-21 14:00:56'),
('PK-LAM', 'A 320', 'BATIK AIR', 'commercial', NULL, '2025-07-21 14:00:56'),
('PK-LAN', 'A 320', 'BATIK AIR', 'commercial', NULL, '2025-07-21 14:00:56'),
('PK-LAO', 'A 320', 'BATIK AIR', 'commercial', NULL, '2025-07-21 14:00:56'),
('PK-LAP', 'A 320', 'BATIK AIR', 'commercial', NULL, '2025-07-21 14:00:56'),
('PK-LAQ', 'A 320', 'BATIK AIR', 'commercial', NULL, '2025-07-21 14:00:56'),
('PK-LAR', 'A 320', 'BATIK AIR', 'commercial', NULL, '2025-07-21 14:00:56'),
('PK-LAS', 'A 320', 'BATIK AIR', 'commercial', NULL, '2025-07-21 14:00:56'),
('PK-LAT', 'A 320', 'BATIK AIR', 'commercial', NULL, '2025-07-21 14:00:56'),
('PK-LAU', 'A 320', 'BATIK AIR', 'commercial', NULL, '2025-07-21 14:00:56'),
('PK-LAV', 'A 320', 'BATIK AIR', 'commercial', NULL, '2025-07-21 14:00:56'),
('PK-LAW', 'A 320', 'BATIK AIR', 'commercial', NULL, '2025-07-21 14:00:56'),
('PK-LAX', 'A 320', 'BATIK AIR', 'commercial', NULL, '2025-07-21 14:00:56'),
('PK-LAY', 'A 320', 'BATIK AIR', 'commercial', NULL, '2025-07-21 14:00:56'),
('PK-LAZ', 'A 320', 'BATIK AIR', 'commercial', NULL, '2025-07-21 14:00:56'),
('PK-LBS', 'CL 850', 'SUIII', 'Commercial', '', '2025-09-07 07:09:53'),
('PK-LBW', 'B 738', 'BATIK AIR', 'commercial', NULL, '2025-07-21 14:00:56'),
('PK-LDA', 'A 320', 'BATIK AIR', 'commercial', NULL, '2025-07-21 14:00:56'),
('PK-LDB', 'A 320', 'BATIK AIR', 'commercial', NULL, '2025-07-21 14:00:56'),
('PK-LDC', 'A 320', 'BATIK AIR', 'commercial', NULL, '2025-07-21 14:00:56'),
('PK-LDD', 'A 320', 'BATIK AIR', 'commercial', NULL, '2025-07-21 14:00:56'),
('PK-LDE', 'A 320', 'BATIK AIR', 'commercial', NULL, '2025-07-21 14:00:56'),
('PK-LDF', 'A 320', 'BATIK AIR', 'commercial', NULL, '2025-07-21 14:00:56'),
('PK-LDG', 'A 320', 'BATIK AIR', 'commercial', NULL, '2025-07-21 14:00:56'),
('PK-LDH', 'A 320', 'BATIK AIR', 'commercial', NULL, '2025-07-21 14:00:56'),
('PK-LDI', 'A 320', 'BATIK AIR', 'commercial', NULL, '2025-07-21 14:00:56'),
('PK-LDJ', 'A 320', 'BATIK AIR', 'commercial', NULL, '2025-07-21 14:00:56'),
('PK-LDK', 'A 320', 'BATIK AIR', 'commercial', NULL, '2025-07-21 14:00:56'),
('PK-LDL', 'A 320', 'BATIK AIR', 'commercial', NULL, '2025-07-21 14:00:56'),
('PK-LDM', 'A 320', 'BATIK AIR', 'commercial', NULL, '2025-07-21 14:00:56'),
('PK-LDN', 'A 320', 'BATIK AIR', 'commercial', NULL, '2025-07-21 14:00:56'),
('PK-LDO', 'A 320', 'BATIK AIR', 'commercial', NULL, '2025-07-21 14:00:56'),
('PK-LDP', 'A 320', 'BATIK AIR', 'commercial', NULL, '2025-07-21 14:00:56'),
('PK-LDQ', 'A 320', 'BATIK AIR', 'commercial', NULL, '2025-07-21 14:00:56'),
('PK-LDR', 'A 320', 'BATIK AIR', 'commercial', NULL, '2025-07-21 14:00:56'),
('PK-LDS', 'A 320', 'BATIK AIR', 'commercial', NULL, '2025-07-21 14:00:56'),
('PK-LDT', 'A 320', 'BATIK AIR', 'commercial', NULL, '2025-07-21 14:00:56'),
('PK-LDU', 'A 320', 'BATIK AIR', 'commercial', NULL, '2025-07-21 14:00:56'),
('PK-LDV', 'A 320', 'BATIK AIR', 'commercial', NULL, '2025-07-21 14:00:56'),
('PK-LDW', 'A 320', 'BATIK AIR', 'commercial', NULL, '2025-07-21 14:00:56'),
('PK-LDX', 'A 320', 'BATIK AIR', 'commercial', NULL, '2025-07-21 14:00:56'),
('PK-LDY', 'A 320', 'BATIK AIR', 'commercial', NULL, '2025-07-21 14:00:56'),
('PK-LDZ', 'A 320', 'BATIK AIR', 'commercial', NULL, '2025-07-21 14:00:56'),
('PK-LUA', 'A 320', 'BATIK AIR', 'commercial', NULL, '2025-07-21 14:00:56'),
('PK-LUB', 'A 320', 'BATIK AIR', 'commercial', NULL, '2025-07-21 14:00:56'),
('PK-LUC', 'A 320', 'BATIK AIR', 'commercial', NULL, '2025-07-21 14:00:56'),
('PK-LUD', 'A 320', 'BATIK AIR', 'commercial', NULL, '2025-07-21 14:00:56'),
('PK-LUE', 'A 320', 'BATIK AIR', 'commercial', NULL, '2025-07-21 14:00:56'),
('PK-LUF', 'A 320', 'BATIK AIR', 'commercial', NULL, '2025-07-21 14:00:56'),
('PK-LUG', 'A 320', 'BATIK AIR', 'commercial', NULL, '2025-07-21 14:00:56'),
('PK-LUH', 'A 320', 'BATIK AIR', 'commercial', NULL, '2025-07-21 14:00:56'),
('PK-LUI', 'A 320', 'BATIK AIR', 'commercial', NULL, '2025-07-21 14:00:56'),
('PK-LUJ', 'A 320', 'BATIK AIR', 'commercial', NULL, '2025-07-21 14:00:56'),
('PK-LUK', 'A 320', 'BATIK AIR', 'commercial', NULL, '2025-07-21 14:00:56'),
('PK-LUL', 'A 320', 'BATIK AIR', 'commercial', NULL, '2025-07-21 14:00:56'),
('PK-LUM', 'A 320', 'BATIK AIR', 'commercial', NULL, '2025-07-21 14:00:56'),
('PK-LUN', 'A 320', 'BATIK AIR', 'commercial', NULL, '2025-07-21 14:00:56'),
('PK-LUO', 'A 320', 'BATIK AIR', 'commercial', NULL, '2025-07-21 14:00:56'),
('PK-LUP', 'A 320', 'BATIK AIR', 'commercial', NULL, '2025-07-21 14:00:56'),
('PK-LUQ', 'A 320', 'BATIK AIR', 'commercial', NULL, '2025-07-21 14:00:56'),
('PK-LUR', 'A 320', 'BATIK AIR', 'commercial', NULL, '2025-07-21 14:00:56'),
('PK-LUS', 'A 320', 'BATIK AIR', 'commercial', NULL, '2025-07-21 14:00:56'),
('PK-LUT', 'A 320', 'BATIK AIR', 'commercial', NULL, '2025-07-21 14:00:56'),
('PK-LUU', 'A 320', 'BATIK AIR', 'commercial', NULL, '2025-07-21 14:00:56'),
('PK-LUV', 'A 320', 'BATIK AIR', 'commercial', NULL, '2025-07-21 14:00:56'),
('PK-LUW', 'A 320', 'BATIK AIR', 'commercial', NULL, '2025-07-21 14:00:56'),
('PK-LUX', 'A 320', 'BATIK AIR', 'commercial', NULL, '2025-07-21 14:00:56'),
('PK-LUY', 'A 320', 'BATIK AIR', 'commercial', NULL, '2025-07-21 14:00:56'),
('PK-LUZ', 'A 320', 'BATIK AIR', 'commercial', NULL, '2025-07-21 14:00:56'),
('PK-LZH', 'A 320', 'BATIK AIR', 'commercial', NULL, '2025-07-21 14:00:56'),
('PK-MBA', 'B 733', 'TRI MG', 'cargo', NULL, '2025-07-21 14:00:56'),
('PK-MBM', 'B 733', '', 'charter', NULL, '2025-07-21 14:00:56'),
('PK-MGZ', 'B 733', 'TRI MG', 'cargo', NULL, '2025-07-21 14:00:56'),
('PK-NKV', 'B 733', 'AIRNESIA', 'cargo', NULL, '2025-07-21 14:00:56'),
('PK-NMI', 'B 733', 'AIRNESIA', 'Cargo', NULL, '2025-10-26 06:09:44'),
('PK-OAM', 'DHC 6', '', 'charter', NULL, '2025-07-21 14:00:56'),
('PK-OCF', 'DHC 6', 'AIRFAST', 'charter', NULL, '2025-07-21 14:00:56'),
('PK-OCH', 'TWIN OTTER', 'AIRFAST', 'charter', NULL, '2025-07-21 14:00:56'),
('PK-OCI', 'DHC 6', 'AIRFAST', 'charter', NULL, '2025-07-21 14:00:56'),
('PK-OCJ', 'DHC 6', '', 'charter', NULL, '2025-07-21 14:00:56'),
('PK-OCK', 'DHC-6', '', 'charter', NULL, '2025-07-21 14:00:56'),
('PK-ODC', 'AS350', 'AIRFAST', 'charter', NULL, '2025-07-21 14:00:56'),
('PK-OTD', 'B 738', 'RIMBUN AIR', 'charter', NULL, '2025-07-21 14:00:56'),
('PK-OTR', 'ATR 72', '', 'charter', NULL, '2025-07-21 14:00:56'),
('PK-PAH', 'ATR 72', 'PELITA', 'Komersial', NULL, '2025-10-26 10:05:37'),
('PK-PAM', 'ATR 72', '', 'charter', NULL, '2025-07-21 14:00:56'),
('PK-PAW', 'ATR 72', 'PELITA', 'commercial', NULL, '2025-07-21 14:00:56'),
('PK-PAX', 'ATR 42', 'PELITA', 'commercial', NULL, '2025-07-21 14:00:56'),
('PK-PDC', 'S 76', 'PELITA', 'commercial', NULL, '2025-07-21 14:00:56'),
('PK-PJJ', 'RJ 85', 'SETNEG', 'charter', NULL, '2025-07-21 14:00:56'),
('PK-PUJ', 'BELL 412', 'PELITA', 'commercial', NULL, '2025-07-21 14:00:56'),
('PK-PUK', 'BELL 412', 'PELITA', 'commercial', NULL, '2025-07-21 14:00:56'),
('PK-RAW', 'DO 328', 'TRIGANA', 'cargo', NULL, '2025-07-21 14:00:56'),
('PK-RDA', 'HK 900', 'TRI MG', 'cargo', NULL, '2025-07-21 14:00:56'),
('PK-RJA', 'EMB 135', 'PREMI', 'charter', NULL, '2025-07-21 14:00:56'),
('PK-RJH', 'EC 135', '', 'charter', NULL, '2025-07-21 14:00:56'),
('PK-RJQ', 'C 172', 'PREMI', 'charter', NULL, '2025-07-21 14:00:56'),
('PK-RJS', 'AW 139', 'PREMI', 'charter', NULL, '2025-07-21 14:00:56'),
('PK-RJT', 'CT 560', 'PREMI', 'charter', NULL, '2025-07-21 14:00:56'),
('PK-RJV', 'C 208', 'PREMI', 'charter', NULL, '2025-07-21 14:00:56'),
('PK-RJX', 'EMB 135', 'PREMI', 'charter', NULL, '2025-07-21 14:00:56'),
('PK-RSO', 'CT 650', 'ENGGANG', 'charter', NULL, '2025-07-21 14:00:56'),
('PK-RSS', 'EMB 135', '', 'charter', NULL, '2025-07-21 14:00:56'),
('PK-RTF', 'C 172', 'GENESA', 'charter', NULL, '2025-07-21 14:00:56'),
('PK-RTK', 'C 172', 'GENESA', 'charter', NULL, '2025-07-21 14:00:56'),
('PK-RTN', 'PIPER PA 34', 'GENESA', 'charter', NULL, '2025-07-21 14:00:56'),
('PK-RTP', 'R 22', '', 'charter', NULL, '2025-07-21 14:00:56'),
('PK-RTW', 'C 172', 'GENESA', 'charter', NULL, '2025-07-21 14:00:56'),
('PK-RTX', 'AS 365', 'GENESA', 'charter', NULL, '2025-07-21 14:00:56'),
('PK-RTY', 'AS 365', '', 'charter', NULL, '2025-07-21 14:00:56'),
('PK-SNF', 'C 208', '', 'charter', NULL, '2025-07-21 14:00:56'),
('PK-SNG', 'C 208', '', 'charter', NULL, '2025-07-21 14:00:56'),
('PK-SNM', 'C 208', '', 'charter', NULL, '2025-07-21 14:00:56'),
('PK-SNN', 'C 208', '', 'charter', NULL, '2025-07-21 14:00:56'),
('PK-SNP', 'C 208', '', 'charter', NULL, '2025-07-21 14:00:56'),
('PK-SNU', 'P-750', '', 'charter', NULL, '2025-07-21 14:00:56'),
('PK-TFS', 'EMB 135', 'IAT', 'charter', NULL, '2025-07-21 14:00:56'),
('PK-THT', 'ATR 42', '', 'charter', NULL, '2025-07-21 14:00:56'),
('PK-TMI', 'G IV', 'TRAVIRA', 'charter', NULL, '2025-07-21 14:00:56'),
('PK-TUM', 'KING AIR', 'TRAVIRA', 'charter', NULL, '2025-07-21 14:00:56'),
('PK-TVB', 'AW 139', 'TRAVIRA', 'charter', NULL, '2025-07-21 14:00:56'),
('PK-TVC', 'AW 139', 'TRAVIRA', 'charter', NULL, '2025-07-21 14:00:56'),
('PK-TVE', 'ATR 72', 'TRAVIRA', 'charter', NULL, '2025-07-21 14:00:56'),
('PK-TVI', 'ATR 42', 'TRAVIRA', 'charter', NULL, '2025-07-21 14:00:56'),
('PK-TVJ', 'AW 139', 'TRAVIRA', 'charter', NULL, '2025-07-21 14:00:56'),
('PK-TVM', 'ATR 72', 'TRAVIRA', 'charter', NULL, '2025-07-21 14:00:56'),
('PK-TVX', 'C 208', 'TRAVIRA', 'charter', NULL, '2025-07-21 14:00:56'),
('PK-TWC', 'AGUSTA', 'TRANSWISATA', 'charter', NULL, '2025-07-21 14:00:56'),
('PK-TWP', 'BELL 412', 'TRANSWISATA', 'charter', NULL, '2025-07-21 14:00:56'),
('PK-TWV', 'BELL 412', 'TRANSWISATA', 'charter', NULL, '2025-07-21 14:00:56'),
('PK-TWW', 'C 212', 'TRANSWISATA', 'charter', NULL, '2025-07-21 14:00:56'),
('PK-TWX', 'KING AIR', 'TRANSWISATA', 'charter', NULL, '2025-07-21 14:00:56'),
('PK-TWY', 'G IV', 'TRANSWISATA', 'charter', NULL, '2025-07-21 14:00:56'),
('PK-TWZ', 'AW 109', 'TRANSWISATA', 'charter', NULL, '2025-07-21 14:00:56'),
('PK-VCD', 'PA 34', 'PENAS', 'charter', NULL, '2025-07-21 14:00:56'),
('PK-VCS', 'EMB 135', 'JETSET', 'charter', NULL, '2025-07-21 14:00:56'),
('PK-VVF', 'C 208', 'SUSI AIR', 'commercial', NULL, '2025-07-21 14:00:56'),
('PK-VVH', 'C 208', 'SUSI AIR', 'commercial', NULL, '2025-07-21 14:00:56'),
('PK-VVM', 'C 208', 'SUSI AIR', 'commercial', NULL, '2025-07-21 14:00:56'),
('PK-VVO', 'C 208', 'SUSI AIR', 'commercial', NULL, '2025-07-21 14:00:56'),
('PK-WMI', 'C 208', '', 'charter', NULL, '2025-07-21 14:00:56'),
('pk-wowow', 'xpander', '', 'Charter', '', '2025-07-22 00:42:55'),
('PK-WSJ', 'BELL 429', '', 'charter', NULL, '2025-07-21 14:00:56'),
('PK-YGK', 'HK 400', 'TRI MG', 'cargo', NULL, '2025-07-21 14:00:56'),
('PK-YGR', 'HK 800', 'TRI MG', 'cargo', NULL, '2025-07-21 14:00:56'),
('PK-YGV', 'B733', 'TRI MG', 'cargo', NULL, '2025-07-21 14:00:56'),
('PK-YRD', 'B 733', 'TRIGANA', 'cargo', NULL, '2025-07-21 14:00:56'),
('PK-YRE', 'ATR 42', '', 'charter', NULL, '2025-07-21 14:00:56'),
('PK-YSC', 'B 733', 'TRIGANA', 'cargo', NULL, '2025-07-21 14:00:56'),
('PK-YSG', 'B 733', 'TRIGANA', 'cargo', NULL, '2025-07-21 14:00:56'),
('PK-YSH', 'B 733', 'SUSI AIR', 'Cargo', NULL, '2025-10-26 06:13:39'),
('PK-YSN', 'B 733', 'TRIGANA', 'cargo', NULL, '2025-07-21 14:00:56'),
('PK-YST', 'B 733', 'TRIGANA', 'Cargo', NULL, '2025-10-30 07:52:25'),
('PK-YSV', 'B 733', 'TRIGANA', 'cargo', NULL, '2025-07-21 14:00:56'),
('PK-YSZ', 'B 733', 'TRIGANA', 'cargo', NULL, '2025-07-21 14:00:56'),
('PT-MBC', 'EMB 550', '', 'charter', NULL, '2025-07-21 14:00:56'),
('RP-C7256', 'ATR 72', '', 'charter', NULL, '2025-07-21 14:00:56'),
('RP-C7257', 'ATR 72', '', 'charter', NULL, '2025-07-21 14:00:56'),
('RP-C8575', 'G IV', '', 'charter', NULL, '2025-07-21 14:00:56'),
('T7-187', 'EMB 135', '', 'charter', NULL, '2025-07-21 14:00:56'),
('T7-3338', 'GLEX', '', 'charter', NULL, '2025-07-21 14:00:56'),
('T7-727', 'HK 800', '', 'charter', NULL, '2025-07-21 14:00:56'),
('T7-777', 'BBJ', 'JIP', 'charter', NULL, '2025-07-21 14:00:56'),
('T7-7HS', 'G VII', 'JIP', 'charter', NULL, '2025-07-21 14:00:56'),
('T7-808', 'G VI', '', 'charter', NULL, '2025-07-21 14:00:56'),
('T7-889', 'EMB 135', '', 'charter', NULL, '2025-07-21 14:00:56'),
('T7-977', 'G IV', '', 'charter', NULL, '2025-07-21 14:00:56'),
('T7-A187', 'GLEX', '', 'charter', NULL, '2025-07-21 14:00:56'),
('T7-AAA', 'GLEX', '', 'charter', NULL, '2025-07-21 14:00:56'),
('T7-ARN', 'G VI', 'PREMI', 'charter', NULL, '2025-07-21 14:00:56'),
('T7-BAT', 'EMB 135', '', 'charter', NULL, '2025-07-21 14:00:56'),
('T7-BOSS', 'A 319', '', 'charter', NULL, '2025-07-21 14:00:56'),
('T7-EQR', 'G IV', '', 'charter', NULL, '2025-07-21 14:00:56'),
('T7-FCN', 'HK 800', '', 'charter', NULL, '2025-07-21 14:00:56'),
('T7-GBS', 'EMB 135', '', 'charter', NULL, '2025-07-21 14:00:56'),
('T7-HKG', 'PH 300', 'PREMI', 'charter', NULL, '2025-07-21 14:00:56'),
('T7-HNA', 'G IV', '', 'charter', NULL, '2025-07-21 14:00:56'),
('T7-J3T', 'G V', 'PREMI', 'charter', NULL, '2025-07-21 14:00:56'),
('T7-JCI', 'EMB 135', '', 'charter', NULL, '2025-07-21 14:00:56'),
('T7-MEL', 'GLEX', 'PREMI', 'charter', NULL, '2025-07-21 14:00:56'),
('T7-MGM', 'G IV', '', 'charter', NULL, '2025-07-21 14:00:56'),
('T7-MPI', 'EMB 135', '', 'charter', NULL, '2025-07-21 14:00:56'),
('T7-RSG', 'G V', '', 'charter', NULL, '2025-07-21 14:00:56'),
('T7-TUN', 'HK 850', '', 'charter', NULL, '2025-07-21 14:00:56'),
('T7-X14', 'G VI', '', 'charter', NULL, '2025-07-21 14:00:56'),
('TC-TRK', 'B 747-800', '', 'charter', NULL, '2025-07-21 14:00:56'),
('TC-TUR', 'A 330-200', '', 'charter', NULL, '2025-07-21 14:00:56'),
('VH-8PO', 'KING AIR', '', 'charter', NULL, '2025-07-21 14:00:56'),
('VH-BVS', 'BARON 58', '', 'charter', NULL, '2025-07-21 14:00:56'),
('VH-CAD', 'FAL 900', '', 'charter', NULL, '2025-07-21 14:00:56'),
('VH-OFJ', 'HK 800', '', 'charter', NULL, '2025-07-21 14:00:56'),
('VH-PFS', 'LJ 45', '', 'charter', NULL, '2025-07-21 14:00:56'),
('VH-RDI', 'LJ 60', '', 'charter', NULL, '2025-07-21 14:00:56'),
('VH-TCN', 'AS 350', '', 'charter', NULL, '2025-07-21 14:00:56'),
('VH-YYQ', 'AS 350', '', 'charter', NULL, '2025-07-21 14:00:56'),
('VN-A268', 'EMB 135', '', 'charter', NULL, '2025-07-21 14:00:56'),
('VN-A878', 'B 787', '', 'charter', NULL, '2025-07-21 14:00:56'),
('VP-CAH', 'G 7500', '', 'charter', NULL, '2025-07-21 14:00:56'),
('VP-CAK', 'G V', '', 'charter', NULL, '2025-07-21 14:00:56'),
('VP-CDZ', 'GLEX', '', 'charter', NULL, '2025-07-21 14:00:56'),
('VP-CGO', 'GLEX', '', 'charter', NULL, '2025-07-21 14:00:56'),
('VP-CLL', 'EMB 135', '', 'charter', NULL, '2025-07-21 14:00:56'),
('VP-CPT', 'GLEX', '', 'charter', NULL, '2025-07-21 14:00:56'),
('VP-CTC', 'G 7500', 'PREMI', 'charter', NULL, '2025-07-21 14:00:56'),
('VP-CTW', 'G VI', '', 'charter', NULL, '2025-07-21 14:00:56'),
('VP-CWS', 'G IV', '', 'charter', NULL, '2025-07-21 14:00:56'),
('VP-CWZ', 'G V', '', 'charter', NULL, '2025-07-21 14:00:56'),
('VT-PRM', 'LINAGE 1000', '', 'charter', NULL, '2025-07-21 14:00:56'),
('ZM-408', 'A 400M', '', 'charter', NULL, '2025-07-21 14:00:56'),
('ZS-ZBB', 'B 733', '', 'charter', NULL, '2025-07-21 14:00:56');

-- --------------------------------------------------------

--
-- Table structure for table `aircraft_movements`
--

CREATE TABLE `aircraft_movements` (
  `id` bigint(20) UNSIGNED NOT NULL,
  `registration` varchar(10) NOT NULL,
  `aircraft_type` varchar(30) DEFAULT NULL,
  `on_block_time` varchar(50) DEFAULT NULL COMMENT 'Stores user input like "1430" or "EX RON". Parsed by backend.',
  `off_block_time` varchar(50) DEFAULT NULL COMMENT 'Stores user input like "1500". Parsed by backend.',
  `parking_stand` varchar(20) NOT NULL,
  `from_location` varchar(50) DEFAULT NULL,
  `to_location` varchar(50) DEFAULT NULL,
  `flight_no_arr` varchar(20) DEFAULT NULL,
  `flight_no_dep` varchar(20) DEFAULT NULL,
  `operator_airline` varchar(100) DEFAULT NULL,
  `remarks` text DEFAULT NULL,
  `is_ron` tinyint(1) NOT NULL DEFAULT 0,
  `ron_complete` tinyint(1) NOT NULL DEFAULT 0,
  `movement_date` date NOT NULL,
  `user_id_created` bigint(20) UNSIGNED NOT NULL,
  `user_id_updated` bigint(20) UNSIGNED NOT NULL,
  `created_at` timestamp NULL DEFAULT current_timestamp(),
  `updated_at` timestamp NULL DEFAULT current_timestamp() ON UPDATE current_timestamp(),
  `on_block_date` date DEFAULT NULL,
  `off_block_date` date DEFAULT NULL
) ENGINE=InnoDB DEFAULT CHARSET=utf8mb4 COLLATE=utf8mb4_unicode_ci;

--
-- Dumping data for table `aircraft_movements`
--

INSERT INTO `aircraft_movements` (`id`, `registration`, `aircraft_type`, `on_block_time`, `off_block_time`, `parking_stand`, `from_location`, `to_location`, `flight_no_arr`, `flight_no_dep`, `operator_airline`, `remarks`, `is_ron`, `ron_complete`, `movement_date`, `user_id_created`, `user_id_updated`, `created_at`, `updated_at`, `on_block_date`, `off_block_date`) VALUES
(26, 'PK-VVM', 'C 208', '12:33 (14/08/2025)', '11:55 (16/08/2025)', 'A0', '', '', '', '', 'SUSI AIR', '', 1, 1, '2025-08-14', 1, 1, '2025-08-14 15:29:18', '2025-08-16 04:32:29', '2025-08-14', '2025-08-16'),
(27, 'PK-YST', 'B 733', '12:33 (14/08/2025)', '22:35 (16/08/2025)', 'B11', '', '', '', '', 'TRIGANA', '', 1, 1, '2025-08-14', 1, 1, '2025-08-14 15:29:40', '2025-08-16 04:47:42', '2025-08-14', '2025-08-16'),
(28, 'PK-NMI', 'B 733', '13:56 (14/08/2025)', '12:55 (16/08/2025)', 'B12', '', '', '', '', 'AIRNESIA', '', 1, 1, '2025-08-14', 1, 1, '2025-08-14 15:29:51', '2025-08-16 04:57:26', '2025-08-14', '2025-08-16'),
(29, 'PK-YSH', 'B 733', '12:23 (14/08/2025)', '14:00 (03/10/2025)', 'B13', '', '', '', '', 'TRIGANA', '', 1, 1, '2025-08-14', 1, 2, '2025-08-14 15:30:18', '2025-10-03 04:06:33', '2025-08-14', '2025-10-03'),
(30, 'PK-PAH', 'ATR 72', '12:35 (14/08/2025) (15/08/2025)', '13:00 (26/10/2025)', 'A2', '', '', 'IP 7301', '', 'PELITA', '', 1, 1, '2025-08-14', 1, 2, '2025-08-14 15:30:27', '2025-10-26 10:05:52', '2025-08-14', '2025-10-26'),
(31, 'PK-GJT', 'ATR 72', '12:33 (14/08/2025)', '15:00 (26/10/2025)', 'A3', '', '', '', '', 'CITILINK', '', 1, 1, '2025-08-14', 1, 2, '2025-08-14 15:30:48', '2025-10-26 06:12:17', '2025-08-14', '2025-10-26'),
(32, 'N-977JH', 'CT 680', '12:35 (1408/2025) (14/08/2025)', '15:00 (14/08/2025)', 'B4', '', '', '', '', 'JIP', '', 1, 1, '2025-08-14', 1, 1, '2025-08-14 15:31:18', '2025-08-14 15:32:33', '2025-08-14', '2025-08-14'),
(33, 'PK-BKR', 'A 320', '12:23 (14/08/2025)', '16:00 (14/08/2025)', 'A3', '', '', '', '', 'BATIK AIR', '', 1, 1, '2025-08-14', 1, 1, '2025-08-14 15:31:27', '2025-08-14 15:33:54', '2025-08-14', '2025-08-14'),
(34, 'PK-BLM', 'A 320', '12:35 (15/08/2025)', '15:22 (15/08/2025)', 'B3', '', '', '', '', 'BATIK AIR', '', 1, 1, '2025-08-15', 1, 1, '2025-08-15 03:16:27', '2025-08-15 03:16:53', '2025-08-15', '2025-08-15'),
(35, 'T7-777', 'B 733', '12:33 (15/08/2025)', '15:00 (16/08/2025)', 'B1', '', '', '', '', 'AIRNESIA', '', 1, 1, '2025-08-15', 1, 1, '2025-08-15 03:58:23', '2025-08-16 05:27:03', '2025-08-15', '2025-08-16'),
(38, 'T7-X14', 'G VI', '12:35 (15/08/2025)', '12:00 (16/08/2025)', 'SA27', '', '', '', '', '', '', 1, 1, '2025-08-15', 1, 1, '2025-08-15 04:03:59', '2025-08-16 05:26:58', '2025-08-15', '2025-08-16'),
(39, 'T7-187', 'EMB 135', '12:35 (15/08/2025)', NULL, 'SA26', '', '', '', '', '', '', 1, 0, '2025-08-15', 1, 1, '2025-08-15 07:19:22', '2025-08-15 07:20:30', '2025-08-15', NULL),
(40, 'VP-CLL', 'EMB 135', '12:23 (15/08/2025)', '15:00 (16/08/2025)', 'SA30', '', '', '', '', '', '', 1, 1, '2025-08-15', 1, 1, '2025-08-15 07:19:38', '2025-08-16 05:26:54', '2025-08-15', '2025-08-16'),
(41, 'PK-GMV', 'B 738', '12:35 (15/08/2025)', NULL, 'SA25', '', '', '', '', 'GARUDA', '', 1, 0, '2025-08-15', 1, 1, '2025-08-15 07:20:08', '2025-08-15 07:21:44', '2025-08-15', NULL),
(42, 'N-484BA', 'LJ 31', '12:35 (15/08/2025)', '13:00 (03/10/2025)', 'B4', '', '', '', '', 'IAP', '', 1, 1, '2025-08-15', 1, 2, '2025-08-15 07:21:03', '2025-10-03 04:06:23', '2025-08-15', '2025-10-03'),
(43, 'N-977JH', 'CT 680', '12:24 (15/08/2025)', '15:00 (16/08/2025)', 'RW08', '', '', '', '', 'JIP', '', 1, 1, '2025-08-15', 1, 1, '2025-08-15 07:21:11', '2025-08-16 03:45:33', '2025-08-15', '2025-08-16'),
(44, 'PK-BON', 'G IV', '12:23 (15/08/2025)', NULL, 'RW02', '', '', '', '', 'JETSET', '', 1, 0, '2025-08-15', 1, 1, '2025-08-15 07:21:32', '2025-08-15 07:21:44', '2025-08-15', NULL),
(45, 'PK-BVX', 'AVANTI', '12:33 (15/08/2025)', NULL, 'NSA15', '', '', '', '', 'SUSI AIR', '', 1, 0, '2025-08-15', 1, 1, '2025-08-15 07:37:46', '2025-08-16 03:44:56', '2025-08-15', NULL),
(46, 'PK-GFM', 'B 738', '12:24 (15/08/2025)', NULL, 'SA05', '', '', '', '', 'GARUDA', '', 1, 0, '2025-08-15', 1, 1, '2025-08-15 07:38:40', '2025-08-16 03:44:56', '2025-08-15', NULL),
(47, 'PK-KAS', 'CL 850', '12:35 (15/08/2025)', NULL, 'SA20', '', '', '', '', 'JETSET', '', 1, 0, '2025-08-15', 1, 1, '2025-08-15 07:38:51', '2025-08-16 03:44:56', '2025-08-15', NULL),
(48, 'pk-grd', 'BBJ 2', '12:33', '15:00 (16/08/2025)', 'B8', '', '', '', '', 'PTN', '', 0, 0, '2025-08-16', 1, 1, '2025-08-16 04:34:09', '2025-08-16 04:34:27', '2025-08-16', '2025-08-16'),
(49, 'PK-AAA', 'A 320', '12:33', '15:56', 'RE01', '', '', '', '', 'SUSI AIR', '', 0, 0, '2025-08-16', 1, 1, '2025-08-16 04:48:47', '2025-08-16 04:48:58', '2025-08-16', '2025-08-16'),
(50, 'PK-NMI', 'B 733', '12:35 (16/08/2025)', NULL, 'B7', '', '', '', '', 'AIRNESIA', '', 1, 0, '2025-08-16', 1, 1, '2025-08-16 05:30:12', '2025-08-28 13:04:37', '2025-08-16', NULL),
(51, 'PK-LUR', 'A 320', '12:35', '18:22', 'B1', '', '', '', '', 'BATIK AIR', '', 0, 0, '2025-08-16', 1, 1, '2025-08-16 05:32:34', '2025-08-16 09:35:12', '2025-08-16', '2025-08-16'),
(52, 'peka peka', '', '12:33 (29/08/2025)', NULL, 'RW06', '', '', '', '', '', '', 1, 0, '2025-08-29', 1, 2, '2025-08-29 15:19:43', '2025-08-31 16:02:35', '2025-08-29', NULL),
(53, 'VP-CLL', 'EMB 135', '12:22 (05/09/2025)', '13:00 (03/10/2025)', 'B1', '', '', '', '', '', '', 1, 1, '2025-09-05', 2, 2, '2025-09-05 02:28:47', '2025-10-03 04:06:46', NULL, '2025-10-03'),
(54, 't7-x14', 'G VI', '13:5 (05/09/2025)', '15:00 (26/10/2025)', 'A1', '', '', '', '', '', '', 1, 1, '2025-09-05', 2, 2, '2025-09-05 06:12:33', '2025-10-26 06:12:26', NULL, '2025-10-26'),
(55, 'PK-LUO', 'A 320', '12:33 (05/09/2025)', NULL, 'SA15', 'WARR', 'WARR', 'ID 7510', 'ID 7515', 'BATIK AIR', '', 1, 0, '2025-09-05', 2, 2, '2025-09-05 06:17:04', '2025-09-07 06:33:12', '2025-09-05', NULL),
(56, 'PK-BKU', 'A 320', '13:45 (05/09/2025)', NULL, 'SA16', 'WARR', 'WARR', 'ID 7514', 'ID 7515', 'BATIK AIR', '', 1, 0, '2025-09-05', 2, 2, '2025-09-05 06:22:01', '2025-09-07 06:33:12', '2025-09-05', NULL),
(57, 'PK-GAB', 'A320', '08:00', '09:00', 'A1', 'SIN', 'CGK', 'GA837', 'GA838', 'Garuda Indonesia', NULL, 0, 0, '2025-09-05', 1, 2, '2025-09-05 08:01:29', '2025-09-05 09:33:54', '2025-09-05', '2025-09-05'),
(58, 'PK-LOH', 'B738', '08:30', '0930', 'B2', 'KUL', 'CGK', 'ID7283', 'ID7284', 'Batik Air', NULL, 0, 0, '2025-09-05', 1, 2, '2025-09-05 08:01:29', '2025-09-05 09:33:54', '2025-09-05', '2025-09-05'),
(59, '9M-LCA', 'A330', '10:00 (05/09/2025)', NULL, 'C3', 'JED', 'CGK', 'OD901', '', 'Malindo Air', NULL, 1, 0, '2025-09-05', 1, 2, '2025-09-05 08:01:29', '2025-09-07 06:33:12', '2025-09-05', NULL),
(60, 'PK-GJV', 'ATR 72', '02:04 (07/09/2025)', NULL, 'WR01', 'WAHH', '', 'QG 1101', '', 'CITILINK', '', 1, 0, '2025-09-07', 2, 2, '2025-09-07 07:05:45', '2025-09-07 08:14:53', '2025-09-07', NULL),
(61, 'PK-YST', 'B 733', '12:33 (17/09/2025)', NULL, 'RE05', '', '', '', '', 'TRIGANA', '', 1, 0, '2025-09-17', 2, 2, '2025-09-17 08:03:45', '2025-09-17 08:14:03', '2025-09-17', NULL),
(62, 'PK-LUBIS', 'XPANDER', ' (19/09/2025)', NULL, 'WR03', '', '', '', '', '', '', 1, 0, '2025-09-17', 2, 2, '2025-09-17 08:14:46', '2025-09-19 15:30:04', NULL, NULL),
(63, 'WADASD', '', '(19/09/2025)', '15:00 (02/10/2025)', 'RW10', '', '', '', '', '', '', 1, 1, '2025-09-17', 2, 2, '2025-09-17 12:25:03', '2025-10-02 11:34:09', NULL, '2025-10-02'),
(64, 'PK-LUO', '', '12:33 (19/09/2025)', NULL, 'SA27', '', '', '', '', '', '', 1, 0, '2025-09-19', 2, 2, '2025-09-19 15:29:17', '2025-09-19 15:30:04', '2025-09-19', NULL),
(65, 'PK-GJV', '', '12:33 (19/09/2025)', NULL, 'SA23', '', '', '', '', '', '', 1, 0, '2025-09-19', 2, 2, '2025-09-19 15:33:36', '2025-09-20 00:15:02', '2025-09-19', NULL),
(66, 'PK-VVH', 'C 208', '19:22 (20/09/2025)', '15:44 (20/09/2025)', 'RW08', '', '', '', '', 'SUSI AIR', '', 1, 1, '2025-09-20', 2, 2, '2025-09-20 00:17:36', '2025-09-20 04:51:51', '2025-09-20', '2025-09-20'),
(67, 'T7-777', 'BBJ', '(03/10/2025)', '14:00 (03/10/2025)', 'B8', '', '', '', '', 'JIP', '', 1, 1, '2025-09-24', 2, 2, '2025-09-24 04:21:39', '2025-10-03 04:25:08', NULL, '2025-10-03'),
(68, 'PK-BVX', 'AVANTI', '12:00', '13:00 (03/10/2025)', 'RW11', '', '', '', '', 'SUSI AIR', '', 0, 0, '2025-10-03', 2, 2, '2025-10-03 04:04:41', '2025-10-03 04:05:14', NULL, '2025-10-03'),
(69, 'PK-VVM', 'C 208', '12:00 (03/10/2025)', NULL, 'RW11', '', '', '', '', 'SUSI AIR', '', 1, 0, '2025-10-03', 2, 2, '2025-10-03 04:05:48', '2025-10-03 04:18:08', '2025-10-03', NULL),
(70, 'PK-TEST', '', '15:55 (03/10/2025)', NULL, 'B5', '', '', '', '', '', '', 1, 0, '2025-10-03', 2, 2, '2025-10-03 04:15:03', '2025-10-03 04:18:08', '2025-10-03', NULL),
(71, 'PK-DBM', '', '12:33 (03/10/2025)', NULL, 'B4', '', '', '', '', '', '', 1, 0, '2025-10-03', 2, 2, '2025-10-03 04:16:36', '2025-10-03 04:18:08', '2025-10-03', NULL),
(72, 'PK-VVH', 'C 208', '12:44 (03/10/2025)', NULL, 'B9', '', '', '', '', 'SUSI AIR', '', 1, 0, '2025-10-03', 2, 2, '2025-10-03 04:24:59', '2025-10-20 10:36:20', NULL, NULL),
(73, 'PK-PAH', 'ATR 72', '12:33 (03/10/2025)', '19:40 (20/10/2025)', 'B1', '', '', '', '', 'PELITA', '', 1, 1, '2025-10-03', 2, 2, '2025-10-03 04:32:05', '2025-10-20 10:40:09', '2025-10-03', '2025-10-20'),
(74, 'PK-NMI', 'B 733', '(26/10/2025)', '13:00 (30/10/2025)', 'B1', '', '', '', '', 'AIRNESIA', '', 1, 1, '2025-10-26', 2, 2, '2025-10-26 06:03:23', '2025-10-30 07:28:27', NULL, '2025-10-30'),
(75, 'PK-NMI', 'B 733', ' (26/10/2025)', NULL, 'B11', '', '', '', '', 'AIRNESIA', '', 1, 0, '2025-10-26', 2, 2, '2025-10-26 06:09:44', '2025-10-26 11:02:57', NULL, NULL),
(76, 'PK-YSH', 'B 733', ' (26/10/2025)', NULL, 'B10', '', '', '', '', 'SUSI AIR', '', 1, 0, '2025-10-26', 2, 2, '2025-10-26 06:13:39', '2025-10-26 11:02:57', NULL, NULL),
(77, 'PK-KAS', 'CL 850', '(26/10/2025)', '15:00 (30/10/2025)', 'B2', '', '', '', '', 'JETSET', '', 1, 1, '2025-10-26', 2, 2, '2025-10-26 06:17:35', '2025-10-30 07:28:16', NULL, '2025-10-30'),
(78, 'PK-JRB', 'B 733', '12:33', '12:44 (26/10/2025)', 'A3', '', '', '', '', 'JAYAWIJAYA', '', 0, 0, '2025-10-26', 2, 2, '2025-10-26 06:22:59', '2025-10-26 06:34:11', NULL, '2025-10-26'),
(79, 'PK-BVX', 'AVANTI', ' (26/10/2025)', NULL, 'B8', '', '', '', '', 'SUSI AIR', '', 1, 0, '2025-10-26', 2, 2, '2025-10-26 06:25:20', '2025-10-26 11:02:57', NULL, NULL),
(80, 'PK-GFM', 'B 738', ' (26/10/2025)', NULL, 'B3', '', '', '', '', 'GARUDA', '', 1, 0, '2025-10-26', 2, 2, '2025-10-26 06:29:49', '2025-10-26 11:02:57', NULL, NULL),
(81, 'PK-GFA', 'B 738', '(26/10/2025)', '15:00 (30/10/2025)', 'A1', '', '', '', '', 'GARUDA', '', 1, 1, '2025-10-26', 2, 2, '2025-10-26 06:31:41', '2025-10-30 07:29:03', NULL, '2025-10-30'),
(82, 'PK-PAH', 'ATR 72', ' (26/10/2025)', NULL, 'A3', '', '', '', '', 'PELITA', '', 1, 0, '2025-10-26', 2, 2, '2025-10-26 10:05:37', '2025-10-26 11:02:57', NULL, NULL),
(83, 'PK-GFM', 'B 738', '12:22 (30/10/2025)', NULL, 'B2', '', '', '', '', 'GARUDA', '', 1, 0, '2025-10-30', 2, 2, '2025-10-30 07:29:32', '2025-11-04 07:39:07', '2025-10-30', NULL),
(84, 'PK-JRB', 'B 733', '12:00 (30/10/2025)', NULL, 'B13', '', '', '', '', 'JAYAWIJAYA', '', 1, 0, '2025-10-30', 2, 2, '2025-10-30 07:34:26', '2025-11-04 07:39:07', '2025-10-30', NULL),
(85, 'PK-YST', 'B 733', '12:23 (30/10/2025)', NULL, 'B12', '', '', '', '', 'TRIGANA', '', 1, 0, '2025-10-30', 2, 2, '2025-10-30 07:52:25', '2025-11-04 07:39:07', '2025-10-30', NULL);

-- --------------------------------------------------------

--
-- Table structure for table `airline_preferences`
--

CREATE TABLE `airline_preferences` (
  `id` int(11) NOT NULL,
  `airline_name` varchar(100) NOT NULL,
  `airline_category` enum('COMMERCIAL','CARGO','CHARTER') NOT NULL,
  `aircraft_type` varchar(50) DEFAULT NULL COMMENT 'NULL means applies to all aircraft types for this airline',
  `stand_name` varchar(10) NOT NULL,
  `priority_score` int(11) NOT NULL DEFAULT 1 COMMENT 'Higher score = higher priority (0100)',
  `notes` text DEFAULT NULL,
  `active` tinyint(1) DEFAULT 1,
  `created_at` timestamp NOT NULL DEFAULT current_timestamp(),
  `updated_at` timestamp NOT NULL DEFAULT current_timestamp() ON UPDATE current_timestamp()
) ENGINE=InnoDB DEFAULT CHARSET=utf8mb4 COLLATE=utf8mb4_unicode_ci;

--
-- Dumping data for table `airline_preferences`
--

INSERT INTO `airline_preferences` (`id`, `airline_name`, `airline_category`, `aircraft_type`, `stand_name`, `priority_score`, `notes`, `active`, `created_at`, `updated_at`) VALUES
(1, 'GARUDA', 'COMMERCIAL', NULL, 'B2', 100, '', 1, '2025-10-24 09:15:32', '2025-10-24 09:15:32'),
(2, 'GARUDA', 'COMMERCIAL', NULL, 'B1', 95, '', 1, '2025-10-24 09:15:32', '2025-10-24 09:15:32'),
(3, 'GARUDA', 'COMMERCIAL', NULL, 'B3', 90, '', 1, '2025-10-24 09:15:32', '2025-10-24 09:15:32'),
(4, 'GARUDA', 'COMMERCIAL', NULL, 'A3', 85, '', 1, '2025-10-24 09:15:32', '2025-10-24 09:15:32'),
(5, 'CITILINK', 'COMMERCIAL', NULL, 'B1', 100, '', 1, '2025-10-24 09:15:32', '2025-10-24 09:15:32'),
(6, 'CITILINK', 'COMMERCIAL', NULL, 'B2', 95, '', 1, '2025-10-24 09:15:32', '2025-10-24 09:15:32'),
(7, 'CITILINK', 'COMMERCIAL', NULL, 'A3', 90, '', 1, '2025-10-24 09:15:32', '2025-10-24 09:15:32'),
(8, 'FLY JAYA', 'COMMERCIAL', NULL, 'B1', 100, '', 1, '2025-10-24 09:15:32', '2025-10-24 09:15:32'),
(9, 'FLY JAYA', 'COMMERCIAL', NULL, 'B2', 95, '', 1, '2025-10-24 09:15:32', '2025-10-24 09:15:32'),
(10, 'FLY JAYA', 'COMMERCIAL', NULL, 'A3', 90, '', 1, '2025-10-24 09:15:32', '2025-10-24 09:15:32'),
(11, 'BATIK AIR', 'COMMERCIAL', NULL, 'A1', 100, '', 1, '2025-10-24 09:15:32', '2025-10-24 09:15:32'),
(12, 'BATIK AIR', 'COMMERCIAL', NULL, 'A2', 95, '', 1, '2025-10-24 09:15:32', '2025-10-24 09:15:32'),
(13, 'BATIK AIR', 'COMMERCIAL', NULL, 'A3', 90, '', 1, '2025-10-24 09:15:32', '2025-10-24 09:15:32'),
(14, 'BATIK AIR', 'COMMERCIAL', NULL, 'B1', 85, '', 1, '2025-10-24 09:15:32', '2025-10-24 09:15:32'),
(15, 'BATIK AIR', 'COMMERCIAL', NULL, 'B6', 80, '', 1, '2025-10-24 09:15:32', '2025-10-24 09:15:32'),
(16, 'BATIK AIR', 'COMMERCIAL', NULL, 'B7', 75, '', 1, '2025-10-24 09:15:32', '2025-10-24 09:15:32'),
(17, 'BATIK AIR', 'COMMERCIAL', NULL, 'B8', 70, '', 1, '2025-10-24 09:15:32', '2025-10-24 09:15:32'),
(18, 'PELITA AIR', 'COMMERCIAL', NULL, 'A1', 100, '', 1, '2025-10-24 09:15:32', '2025-10-24 09:15:32'),
(19, 'PELITA AIR', 'COMMERCIAL', NULL, 'A2', 95, '', 1, '2025-10-24 09:15:32', '2025-10-24 09:15:32'),
(20, 'PELITA AIR', 'COMMERCIAL', NULL, 'A3', 90, '', 1, '2025-10-24 09:15:32', '2025-10-24 09:15:32'),
(21, 'PELITA AIR', 'COMMERCIAL', NULL, 'B1', 85, '', 1, '2025-10-24 09:15:32', '2025-10-24 09:15:32'),
(22, 'SUSI AIR', 'COMMERCIAL', NULL, 'A0', 100, '', 1, '2025-10-24 09:15:32', '2025-10-24 09:15:32'),
(23, 'SUSI AIR', 'COMMERCIAL', NULL, 'B7', 95, '', 1, '2025-10-24 09:15:32', '2025-10-24 09:15:32'),
(24, 'TRIGANA AIR', 'CARGO', NULL, 'B13', 100, '', 1, '2025-10-24 09:15:32', '2025-10-24 09:15:32'),
(25, 'TRIGANA AIR', 'CARGO', NULL, 'B12', 95, '', 1, '2025-10-24 09:15:32', '2025-10-24 09:15:32'),
(26, 'TRIGANA AIR', 'CARGO', NULL, 'B11', 90, '', 1, '2025-10-24 09:15:32', '2025-10-24 09:15:32'),
(27, 'TRIGANA AIR', 'CARGO', NULL, 'B10', 85, '', 1, '2025-10-24 09:15:32', '2025-10-24 09:15:32'),
(28, 'TRIGANA AIR', 'CARGO', NULL, 'B9', 80, '', 1, '2025-10-24 09:15:32', '2025-10-24 09:15:32'),
(29, 'CITILINK CARGO', 'CARGO', NULL, 'B13', 100, '', 1, '2025-10-24 09:15:32', '2025-10-24 09:15:32'),
(30, 'CITILINK CARGO', 'CARGO', NULL, 'B12', 95, '', 1, '2025-10-24 09:15:32', '2025-10-24 09:15:32'),
(31, 'CITILINK CARGO', 'CARGO', NULL, 'B11', 90, '', 1, '2025-10-24 09:15:32', '2025-10-24 09:15:32'),
(32, 'CITILINK CARGO', 'CARGO', NULL, 'B10', 85, '', 1, '2025-10-24 09:15:32', '2025-10-24 09:15:32'),
(33, 'CITILINK CARGO', 'CARGO', NULL, 'B9', 80, '', 1, '2025-10-24 09:15:32', '2025-10-24 09:15:32'),
(34, 'AIRNESIA', 'CARGO', NULL, 'B13', 100, '', 1, '2025-10-24 09:15:32', '2025-10-24 09:15:32'),
(35, 'AIRNESIA', 'CARGO', NULL, 'B12', 95, '', 1, '2025-10-24 09:15:32', '2025-10-24 09:15:32'),
(36, 'AIRNESIA', 'CARGO', NULL, 'B11', 90, '', 1, '2025-10-24 09:15:32', '2025-10-24 09:15:32'),
(37, 'AIRNESIA', 'CARGO', NULL, 'B10', 85, '', 1, '2025-10-24 09:15:32', '2025-10-24 09:15:32'),
(38, 'AIRNESIA', 'CARGO', NULL, 'B9', 80, '', 1, '2025-10-24 09:15:32', '2025-10-24 09:15:32'),
(39, 'JAYA WIJAYA', 'CARGO', NULL, 'B13', 100, '', 1, '2025-10-24 09:15:32', '2025-10-24 09:15:32'),
(40, 'JAYA WIJAYA', 'CARGO', NULL, 'B12', 95, '', 1, '2025-10-24 09:15:32', '2025-10-24 09:15:32'),
(41, 'JAYA WIJAYA', 'CARGO', NULL, 'B11', 90, '', 1, '2025-10-24 09:15:32', '2025-10-24 09:15:32'),
(42, 'JAYA WIJAYA', 'CARGO', NULL, 'B10', 85, '', 1, '2025-10-24 09:15:32', '2025-10-24 09:15:32'),
(43, 'JAYA WIJAYA', 'CARGO', NULL, 'B9', 80, '', 1, '2025-10-24 09:15:32', '2025-10-24 09:15:32'),
(44, 'B.B.N AIRLINES', 'CARGO', NULL, 'B13', 100, '', 1, '2025-10-24 09:15:32', '2025-10-24 09:15:32'),
(45, 'B.B.N AIRLINES', 'CARGO', NULL, 'B12', 95, '', 1, '2025-10-24 09:15:32', '2025-10-24 09:15:32'),
(46, 'B.B.N AIRLINES', 'CARGO', NULL, 'B11', 90, '', 1, '2025-10-24 09:15:32', '2025-10-24 09:15:32'),
(47, 'B.B.N AIRLINES', 'CARGO', NULL, 'B10', 85, '', 1, '2025-10-24 09:15:32', '2025-10-24 09:15:32'),
(48, 'B.B.N AIRLINES', 'CARGO', NULL, 'B9', 80, '', 1, '2025-10-24 09:15:32', '2025-10-24 09:15:32'),
(49, 'TRI MG', 'CARGO', NULL, 'B13', 100, '', 1, '2025-10-24 09:15:32', '2025-10-24 09:15:32'),
(50, 'TRI MG', 'CARGO', NULL, 'B12', 95, '', 1, '2025-10-24 09:15:32', '2025-10-24 09:15:32'),
(51, 'TRI MG', 'CARGO', NULL, 'B11', 90, '', 1, '2025-10-24 09:15:32', '2025-10-24 09:15:32'),
(52, 'TRI MG', 'CARGO', NULL, 'B10', 85, '', 1, '2025-10-24 09:15:32', '2025-10-24 09:15:32'),
(53, 'TRI MG', 'CARGO', NULL, 'B9', 80, '', 1, '2025-10-24 09:15:32', '2025-10-24 09:15:32'),
(54, 'JAS', 'CHARTER', NULL, 'B3', 100, '', 1, '2025-10-24 09:15:32', '2025-10-24 09:15:32'),
(55, 'JAS', 'CHARTER', NULL, 'B4', 95, '', 1, '2025-10-24 09:15:32', '2025-10-24 09:15:32'),
(56, 'JAS', 'CHARTER', NULL, 'B5', 90, '', 1, '2025-10-24 09:15:32', '2025-10-24 09:15:32'),
(57, 'JAS', 'CHARTER', NULL, 'B6', 85, '', 1, '2025-10-24 09:15:32', '2025-10-24 09:15:32'),
(58, 'JAS', 'CHARTER', NULL, 'B7', 80, '', 1, '2025-10-24 09:15:32', '2025-10-24 09:15:32'),
(59, 'TRAVIRA', 'CHARTER', NULL, 'B3', 100, '', 1, '2025-10-24 09:15:32', '2025-10-24 09:15:32'),
(60, 'TRAVIRA', 'CHARTER', NULL, 'B4', 95, '', 1, '2025-10-24 09:15:32', '2025-10-24 09:15:32'),
(61, 'TRAVIRA', 'CHARTER', NULL, 'B5', 90, '', 1, '2025-10-24 09:15:32', '2025-10-24 09:15:32'),
(62, 'TRAVIRA', 'CHARTER', NULL, 'B6', 85, '', 1, '2025-10-24 09:15:32', '2025-10-24 09:15:32'),
(63, 'TRAVIRA', 'CHARTER', NULL, 'B7', 80, '', 1, '2025-10-24 09:15:32', '2025-10-24 09:15:32'),
(64, 'AIRNESIA', 'CHARTER', NULL, 'B3', 100, '', 1, '2025-10-24 09:15:32', '2025-10-24 09:15:32'),
(65, 'AIRNESIA', 'CHARTER', NULL, 'B4', 95, '', 1, '2025-10-24 09:15:32', '2025-10-24 09:15:32'),
(66, 'AIRNESIA', 'CHARTER', NULL, 'B5', 90, '', 1, '2025-10-24 09:15:32', '2025-10-24 09:15:32'),
(67, 'AIRNESIA', 'CHARTER', NULL, 'B6', 85, '', 1, '2025-10-24 09:15:32', '2025-10-24 09:15:32'),
(68, 'AIRNESIA', 'CHARTER', NULL, 'B7', 80, '', 1, '2025-10-24 09:15:32', '2025-10-24 09:15:32'),
(69, 'JETSET', 'CHARTER', NULL, 'B3', 100, '', 1, '2025-10-24 09:15:32', '2025-10-24 09:15:32'),
(70, 'JETSET', 'CHARTER', NULL, 'B4', 95, '', 1, '2025-10-24 09:15:32', '2025-10-24 09:15:32'),
(71, 'JETSET', 'CHARTER', NULL, 'B5', 90, '', 1, '2025-10-24 09:15:32', '2025-10-24 09:15:32'),
(72, 'JETSET', 'CHARTER', NULL, 'B6', 85, '', 1, '2025-10-24 09:15:32', '2025-10-24 09:15:32'),
(73, 'JETSET', 'CHARTER', NULL, 'B7', 80, '', 1, '2025-10-24 09:15:32', '2025-10-24 09:15:32'),
(74, 'KARISMA', 'CHARTER', NULL, 'B3', 100, '', 1, '2025-10-24 09:15:32', '2025-10-24 09:15:32'),
(75, 'KARISMA', 'CHARTER', NULL, 'B4', 95, '', 1, '2025-10-24 09:15:32', '2025-10-24 09:15:32'),
(76, 'KARISMA', 'CHARTER', NULL, 'B5', 90, '', 1, '2025-10-24 09:15:32', '2025-10-24 09:15:32'),
(77, 'KARISMA', 'CHARTER', NULL, 'B6', 85, '', 1, '2025-10-24 09:15:32', '2025-10-24 09:15:32'),
(78, 'KARISMA', 'CHARTER', NULL, 'B7', 80, '', 1, '2025-10-24 09:15:32', '2025-10-24 09:15:32'),
(79, 'IAT', 'CHARTER', NULL, 'B3', 100, '', 1, '2025-10-24 09:15:32', '2025-10-24 09:15:32'),
(80, 'IAT', 'CHARTER', NULL, 'B4', 95, '', 1, '2025-10-24 09:15:32', '2025-10-24 09:15:32'),
(81, 'IAT', 'CHARTER', NULL, 'B5', 90, '', 1, '2025-10-24 09:15:32', '2025-10-24 09:15:32'),
(82, 'IAT', 'CHARTER', NULL, 'B6', 85, '', 1, '2025-10-24 09:15:32', '2025-10-24 09:15:32'),
(83, 'IAT', 'CHARTER', NULL, 'B7', 80, '', 1, '2025-10-24 09:15:32', '2025-10-24 09:15:32'),
(84, 'JIP', 'CHARTER', NULL, 'B3', 100, '', 1, '2025-10-24 09:15:32', '2025-10-24 09:15:32'),
(85, 'JIP', 'CHARTER', NULL, 'B4', 95, '', 1, '2025-10-24 09:15:32', '2025-10-24 09:15:32'),
(86, 'JIP', 'CHARTER', NULL, 'B5', 90, '', 1, '2025-10-24 09:15:32', '2025-10-24 09:15:32'),
(87, 'JIP', 'CHARTER', NULL, 'B6', 85, '', 1, '2025-10-24 09:15:32', '2025-10-24 09:15:32'),
(88, 'JIP', 'CHARTER', NULL, 'B7', 80, '', 1, '2025-10-24 09:15:32', '2025-10-24 09:15:32'),
(89, 'AFM', 'CHARTER', NULL, 'B3', 100, '', 1, '2025-10-24 09:15:32', '2025-10-24 09:15:32'),
(90, 'AFM', 'CHARTER', NULL, 'B4', 95, '', 1, '2025-10-24 09:15:32', '2025-10-24 09:15:32'),
(91, 'AFM', 'CHARTER', NULL, 'B5', 90, '', 1, '2025-10-24 09:15:32', '2025-10-24 09:15:32'),
(92, 'AFM', 'CHARTER', NULL, 'B6', 85, '', 1, '2025-10-24 09:15:32', '2025-10-24 09:15:32'),
(93, 'AFM', 'CHARTER', NULL, 'B7', 80, '', 1, '2025-10-24 09:15:32', '2025-10-24 09:15:32'),
(94, 'PELITA', 'CHARTER', NULL, 'B3', 100, '', 1, '2025-10-24 09:15:32', '2025-10-24 09:15:32'),
(95, 'PELITA', 'CHARTER', NULL, 'B4', 95, '', 1, '2025-10-24 09:15:32', '2025-10-24 09:15:32'),
(96, 'PELITA', 'CHARTER', NULL, 'B5', 90, '', 1, '2025-10-24 09:15:32', '2025-10-24 09:15:32'),
(97, 'PELITA', 'CHARTER', NULL, 'B6', 85, '', 1, '2025-10-24 09:15:32', '2025-10-24 09:15:32'),
(98, 'PELITA', 'CHARTER', NULL, 'B7', 80, '', 1, '2025-10-24 09:15:32', '2025-10-24 09:15:32'),
(99, 'GENESA', 'CHARTER', NULL, 'B3', 100, '', 1, '2025-10-24 09:15:32', '2025-10-24 09:15:32'),
(100, 'GENESA', 'CHARTER', NULL, 'B4', 95, '', 1, '2025-10-24 09:15:32', '2025-10-24 09:15:32'),
(101, 'GENESA', 'CHARTER', NULL, 'B5', 90, '', 1, '2025-10-24 09:15:32', '2025-10-24 09:15:32'),
(102, 'GENESA', 'CHARTER', NULL, 'B6', 85, '', 1, '2025-10-24 09:15:32', '2025-10-24 09:15:32'),
(103, 'GENESA', 'CHARTER', NULL, 'B7', 80, '', 1, '2025-10-24 09:15:32', '2025-10-24 09:15:32'),
(104, 'PREMI', 'CHARTER', NULL, 'B3', 100, '', 1, '2025-10-24 09:15:32', '2025-10-24 09:15:32'),
(105, 'PREMI', 'CHARTER', NULL, 'B4', 95, '', 1, '2025-10-24 09:15:32', '2025-10-24 09:15:32'),
(106, 'PREMI', 'CHARTER', NULL, 'B5', 90, '', 1, '2025-10-24 09:15:32', '2025-10-24 09:15:32'),
(107, 'PREMI', 'CHARTER', NULL, 'B6', 85, '', 1, '2025-10-24 09:15:32', '2025-10-24 09:15:32'),
(108, 'PREMI', 'CHARTER', NULL, 'B7', 80, '', 1, '2025-10-24 09:15:32', '2025-10-24 09:15:32'),
(109, 'PURAWISATA', 'CHARTER', NULL, 'B3', 100, '', 1, '2025-10-24 09:15:32', '2025-10-24 09:15:32'),
(110, 'PURAWISATA', 'CHARTER', NULL, 'B4', 95, '', 1, '2025-10-24 09:15:32', '2025-10-24 09:15:32'),
(111, 'PURAWISATA', 'CHARTER', NULL, 'B5', 90, '', 1, '2025-10-24 09:15:32', '2025-10-24 09:15:32'),
(112, 'PURAWISATA', 'CHARTER', NULL, 'B6', 85, '', 1, '2025-10-24 09:15:32', '2025-10-24 09:15:32'),
(113, 'PURAWISATA', 'CHARTER', NULL, 'B7', 80, '', 1, '2025-10-24 09:15:32', '2025-10-24 09:15:32'),
(114, 'PTN', 'CHARTER', NULL, 'B3', 100, '', 1, '2025-10-24 09:15:32', '2025-10-24 09:15:32'),
(115, 'PTN', 'CHARTER', NULL, 'B4', 95, '', 1, '2025-10-24 09:15:32', '2025-10-24 09:15:32'),
(116, 'PTN', 'CHARTER', NULL, 'B5', 90, '', 1, '2025-10-24 09:15:32', '2025-10-24 09:15:32'),
(117, 'PTN', 'CHARTER', NULL, 'B6', 85, '', 1, '2025-10-24 09:15:33', '2025-10-24 09:15:33'),
(118, 'PTN', 'CHARTER', NULL, 'B7', 80, '', 1, '2025-10-24 09:15:33', '2025-10-24 09:15:33'),
(119, 'BIOMANTARA', 'CHARTER', NULL, 'B3', 100, '', 1, '2025-10-24 09:15:33', '2025-10-24 09:15:33'),
(120, 'BIOMANTARA', 'CHARTER', NULL, 'B4', 95, '', 1, '2025-10-24 09:15:33', '2025-10-24 09:15:33'),
(121, 'BIOMANTARA', 'CHARTER', NULL, 'B5', 90, '', 1, '2025-10-24 09:15:33', '2025-10-24 09:15:33'),
(122, 'BIOMANTARA', 'CHARTER', NULL, 'B6', 85, '', 1, '2025-10-24 09:15:33', '2025-10-24 09:15:33'),
(123, 'BIOMANTARA', 'CHARTER', NULL, 'B7', 80, '', 1, '2025-10-24 09:15:33', '2025-10-24 09:15:33'),
(124, 'SUBA AIR', 'CHARTER', NULL, 'B3', 100, '', 1, '2025-10-24 09:15:33', '2025-10-24 09:15:33'),
(125, 'SUBA AIR', 'CHARTER', NULL, 'B4', 95, '', 1, '2025-10-24 09:15:33', '2025-10-24 09:15:33'),
(126, 'SUBA AIR', 'CHARTER', NULL, 'B5', 90, '', 1, '2025-10-24 09:15:33', '2025-10-24 09:15:33'),
(127, 'SUBA AIR', 'CHARTER', NULL, 'B6', 85, '', 1, '2025-10-24 09:15:33', '2025-10-24 09:15:33'),
(128, 'SUBA AIR', 'CHARTER', NULL, 'B7', 80, '', 1, '2025-10-24 09:15:33', '2025-10-24 09:15:33'),
(129, 'AIR PASIFIC', 'CHARTER', NULL, 'B3', 100, '', 1, '2025-10-24 09:15:33', '2025-10-24 09:15:33'),
(130, 'AIR PASIFIC', 'CHARTER', NULL, 'B4', 95, '', 1, '2025-10-24 09:15:33', '2025-10-24 09:15:33'),
(131, 'AIR PASIFIC', 'CHARTER', NULL, 'B5', 90, '', 1, '2025-10-24 09:15:33', '2025-10-24 09:15:33'),
(132, 'AIR PASIFIC', 'CHARTER', NULL, 'B6', 85, '', 1, '2025-10-24 09:15:33', '2025-10-24 09:15:33'),
(133, 'AIR PASIFIC', 'CHARTER', NULL, 'B7', 80, '', 1, '2025-10-24 09:15:33', '2025-10-24 09:15:33'),
(134, 'DEPHUB', 'CHARTER', NULL, 'B3', 100, '', 1, '2025-10-24 09:15:33', '2025-10-24 09:15:33'),
(135, 'DEPHUB', 'CHARTER', NULL, 'B4', 95, '', 1, '2025-10-24 09:15:33', '2025-10-24 09:15:33'),
(136, 'DEPHUB', 'CHARTER', NULL, 'B5', 90, '', 1, '2025-10-24 09:15:33', '2025-10-24 09:15:33'),
(137, 'DEPHUB', 'CHARTER', NULL, 'B6', 85, '', 1, '2025-10-24 09:15:33', '2025-10-24 09:15:33'),
(138, 'DEPHUB', 'CHARTER', NULL, 'B7', 80, '', 1, '2025-10-24 09:15:33', '2025-10-24 09:15:33'),
(139, 'BGS', 'CHARTER', NULL, 'B3', 100, '', 1, '2025-10-24 09:15:33', '2025-10-24 09:15:33'),
(140, 'BGS', 'CHARTER', NULL, 'B4', 95, '', 1, '2025-10-24 09:15:33', '2025-10-24 09:15:33'),
(141, 'BGS', 'CHARTER', NULL, 'B5', 90, '', 1, '2025-10-24 09:15:33', '2025-10-24 09:15:33'),
(142, 'BGS', 'CHARTER', NULL, 'B6', 85, '', 1, '2025-10-24 09:15:33', '2025-10-24 09:15:33'),
(143, 'BGS', 'CHARTER', NULL, 'B7', 80, '', 1, '2025-10-24 09:15:33', '2025-10-24 09:15:33'),
(144, 'TRANSWISATA', 'CHARTER', NULL, 'B3', 100, '', 1, '2025-10-24 09:15:33', '2025-10-24 09:15:33'),
(145, 'TRANSWISATA', 'CHARTER', NULL, 'B4', 95, '', 1, '2025-10-24 09:15:33', '2025-10-24 09:15:33'),
(146, 'TRANSWISATA', 'CHARTER', NULL, 'B5', 90, '', 1, '2025-10-24 09:15:33', '2025-10-24 09:15:33'),
(147, 'TRANSWISATA', 'CHARTER', NULL, 'B6', 85, '', 1, '2025-10-24 09:15:33', '2025-10-24 09:15:33'),
(148, 'TRANSWISATA', 'CHARTER', NULL, 'B7', 80, '', 1, '2025-10-24 09:15:33', '2025-10-24 09:15:33'),
(149, 'GAPURA', 'CHARTER', NULL, 'B3', 100, '', 1, '2025-10-24 09:15:33', '2025-10-24 09:15:33'),
(150, 'GAPURA', 'CHARTER', NULL, 'B4', 95, '', 1, '2025-10-24 09:15:33', '2025-10-24 09:15:33'),
(151, 'GAPURA', 'CHARTER', NULL, 'B5', 90, '', 1, '2025-10-24 09:15:33', '2025-10-24 09:15:33'),
(152, 'GAPURA', 'CHARTER', NULL, 'B6', 85, '', 1, '2025-10-24 09:15:33', '2025-10-24 09:15:33'),
(153, 'GAPURA', 'CHARTER', NULL, 'B7', 80, '', 1, '2025-10-24 09:15:33', '2025-10-24 09:15:33'),
(154, 'AMM', 'CHARTER', NULL, 'B3', 100, '', 1, '2025-10-24 09:15:33', '2025-10-24 09:15:33'),
(155, 'AMM', 'CHARTER', NULL, 'B4', 95, '', 1, '2025-10-24 09:15:33', '2025-10-24 09:15:33'),
(156, 'AMM', 'CHARTER', NULL, 'B5', 90, '', 1, '2025-10-24 09:15:33', '2025-10-24 09:15:33'),
(157, 'AMM', 'CHARTER', NULL, 'B6', 85, '', 1, '2025-10-24 09:15:33', '2025-10-24 09:15:33'),
(158, 'AMM', 'CHARTER', NULL, 'B7', 80, '', 1, '2025-10-24 09:15:33', '2025-10-24 09:15:33'),
(159, 'B. G. S.', 'CHARTER', NULL, 'B3', 100, '', 1, '2025-10-24 09:15:33', '2025-10-24 09:15:33'),
(160, 'B. G. S.', 'CHARTER', NULL, 'B4', 95, '', 1, '2025-10-24 09:15:33', '2025-10-24 09:15:33'),
(161, 'B. G. S.', 'CHARTER', NULL, 'B5', 90, '', 1, '2025-10-24 09:15:33', '2025-10-24 09:15:33'),
(162, 'B. G. S.', 'CHARTER', NULL, 'B6', 85, '', 1, '2025-10-24 09:15:33', '2025-10-24 09:15:33'),
(163, 'B. G. S.', 'CHARTER', NULL, 'B7', 80, '', 1, '2025-10-24 09:15:33', '2025-10-24 09:15:33'),
(164, 'AIRFAST', 'CHARTER', NULL, 'B3', 100, '', 1, '2025-10-24 09:15:33', '2025-10-24 09:15:33'),
(165, 'AIRFAST', 'CHARTER', NULL, 'B4', 95, '', 1, '2025-10-24 09:15:33', '2025-10-24 09:15:33'),
(166, 'AIRFAST', 'CHARTER', NULL, 'B5', 90, '', 1, '2025-10-24 09:15:33', '2025-10-24 09:15:33'),
(167, 'AIRFAST', 'CHARTER', NULL, 'B6', 85, '', 1, '2025-10-24 09:15:33', '2025-10-24 09:15:33'),
(168, 'AIRFAST', 'CHARTER', NULL, 'B7', 80, '', 1, '2025-10-24 09:15:33', '2025-10-24 09:15:33'),
(169, 'TAS', 'CHARTER', NULL, 'B3', 100, '', 1, '2025-10-24 09:15:33', '2025-10-24 09:15:33'),
(170, 'TAS', 'CHARTER', NULL, 'B4', 95, '', 1, '2025-10-24 09:15:33', '2025-10-24 09:15:33'),
(171, 'TAS', 'CHARTER', NULL, 'B5', 90, '', 1, '2025-10-24 09:15:33', '2025-10-24 09:15:33'),
(172, 'TAS', 'CHARTER', NULL, 'B6', 85, '', 1, '2025-10-24 09:15:33', '2025-10-24 09:15:33'),
(173, 'TAS', 'CHARTER', NULL, 'B7', 80, '', 1, '2025-10-24 09:15:33', '2025-10-24 09:15:33');

-- --------------------------------------------------------

--
-- Table structure for table `audit_log`
--

CREATE TABLE `audit_log` (
  `id` bigint(20) UNSIGNED NOT NULL,
  `user_id` bigint(20) UNSIGNED NOT NULL,
  `action_type` varchar(50) NOT NULL COMMENT 'e.g., CREATE_MOVEMENT, UPDATE_USER',
  `target_table` varchar(50) NOT NULL,
  `target_id` bigint(20) UNSIGNED NOT NULL,
  `old_values` text DEFAULT NULL COMMENT 'JSON-encoded old data',
  `new_values` text NOT NULL COMMENT 'JSON-encoded new data',
  `action_timestamp` timestamp NULL DEFAULT current_timestamp()
) ENGINE=InnoDB DEFAULT CHARSET=utf8mb4 COLLATE=utf8mb4_unicode_ci;

--
-- Dumping data for table `audit_log`
--

INSERT INTO `audit_log` (`id`, `user_id`, `action_type`, `target_table`, `target_id`, `old_values`, `new_values`, `action_timestamp`) VALUES
(1, 4, 'LOGIN_FAIL', 'users', 4, NULL, '{\"ip\":\"::1\"}', '2025-08-29 16:03:03'),
(2, 4, 'LOGIN_SUCCESS', 'users', 4, NULL, '', '2025-08-29 16:03:26'),
(3, 4, 'LOGOUT', 'users', 4, NULL, '', '2025-08-29 16:04:08'),
(4, 3, 'LOGIN_SUCCESS', 'users', 3, NULL, '', '2025-08-29 16:04:22'),
(5, 3, 'LOGOUT', 'users', 3, NULL, '', '2025-08-29 16:06:27'),
(6, 2, 'LOGIN_SUCCESS', 'users', 2, NULL, '', '2025-08-29 16:06:35'),
(7, 2, 'LOGOUT', 'users', 2, NULL, '', '2025-08-29 16:10:49'),
(8, 2, 'LOGIN_SUCCESS', 'users', 2, NULL, '', '2025-08-29 16:10:59'),
(9, 2, 'LOGIN_FAIL', 'users', 2, NULL, '{\"ip\":\"::1\"}', '2025-08-29 16:11:39'),
(10, 2, 'LOGIN_FAIL', 'users', 2, NULL, '{\"ip\":\"::1\"}', '2025-08-29 16:11:46'),
(11, 2, 'LOGIN_FAIL', 'users', 2, NULL, '{\"ip\":\"::1\"}', '2025-08-29 16:11:53'),
(12, 2, 'LOGIN_SUCCESS', 'users', 2, NULL, '', '2025-08-29 16:12:07'),
(13, 2, 'LOGOUT', 'users', 2, NULL, '', '2025-08-29 16:16:46'),
(14, 4, 'LOGIN_SUCCESS', 'users', 4, NULL, '', '2025-08-29 16:16:57'),
(15, 4, 'LOGOUT', 'users', 4, NULL, '', '2025-08-29 16:17:43'),
(16, 2, 'LOGIN_SUCCESS', 'users', 2, NULL, '', '2025-08-29 16:17:54'),
(17, 2, 'LOGOUT', 'users', 2, NULL, '', '2025-08-29 16:18:38'),
(18, 3, 'LOGIN_SUCCESS', 'users', 3, NULL, '', '2025-08-29 16:18:53'),
(19, 3, 'LOGOUT', 'users', 3, NULL, '', '2025-08-29 16:19:06'),
(20, 2, 'LOGIN_SUCCESS', 'users', 2, NULL, '', '2025-08-29 16:19:13'),
(21, 2, 'LOGOUT', 'users', 2, NULL, '', '2025-08-29 16:20:03'),
(22, 2, 'LOGIN_SUCCESS', 'users', 2, NULL, '', '2025-08-29 16:23:43'),
(23, 2, 'LOGIN_FAIL', 'users', 2, NULL, '{\"ip\":\"::1\"}', '2025-08-31 12:52:59'),
(24, 2, 'LOGIN_SUCCESS', 'users', 2, NULL, '', '2025-08-31 12:53:16'),
(25, 2, 'CREATE_USER', 'users', 5, NULL, '{\"username\":\"syarifadriann\",\"email\":\"syarifadrian9@gmail.com\",\"role\":\"operator\",\"status\":\"active\"}', '2025-08-31 14:13:04'),
(26, 2, 'LOGIN_SUCCESS', 'users', 2, NULL, '', '2025-08-31 14:33:59'),
(27, 2, 'LOGIN_SUCCESS', 'users', 2, NULL, '', '2025-08-31 15:18:40'),
(28, 2, 'UPDATE_USER', 'users', 2, '{\"id\":2,\"username\":\"admingpt\",\"password_hash\":\"$2y$10$.AQ5AXg5eXZSET9DSC8BVOKuXA5o.xBNLDk4qOREy85P2FOofxvEC\",\"role\":\"admin\",\"status\":\"active\",\"last_login_at\":null,\"must_change_password\":0,\"full_name\":null,\"email\":\"admin@amc.local\",\"is_active\":1,\"created_at\":\"2025-08-29 22:39:44\",\"updated_at\":\"2025-08-29 22:39:44\"}', '{\"id\":\"2\",\"csrf_token\":\"a4743313cbc9001ca0922a67be6bd0c1a094a8a938026b839ca47d8c10dbcd4e\",\"full_name\":\"admin\",\"username\":\"admingpt\",\"email\":\"admin@amc.local\",\"role\":\"admin\",\"status\":\"active\",\"password\":\"uhuy\",\"action\":\"update\"}', '2025-08-31 15:19:27'),
(29, 2, 'UPDATE_USER', 'users', 3, '{\"id\":3,\"username\":\"operatorgpt\",\"password_hash\":\"$2y$10$DY49yWh0aN5.eR23wk\\/PwezkLf8w3tAiimG2.bvu4wdPKn9nH4VhW\",\"role\":\"operator\",\"status\":\"active\",\"last_login_at\":null,\"must_change_password\":0,\"full_name\":null,\"email\":\"operator@amc.local\",\"is_active\":1,\"created_at\":\"2025-08-29 22:39:44\",\"updated_at\":\"2025-08-29 22:39:44\"}', '{\"id\":\"3\",\"csrf_token\":\"a4743313cbc9001ca0922a67be6bd0c1a094a8a938026b839ca47d8c10dbcd4e\",\"full_name\":\"operator\",\"username\":\"operatorgpt\",\"email\":\"operator@amc.local\",\"role\":\"operator\",\"status\":\"active\",\"password\":\"\",\"action\":\"update\"}', '2025-08-31 15:19:38'),
(30, 2, 'CREATE_USER', 'users', 6, NULL, '{\"username\":\"amc\",\"email\":\"amchlp@gmail.com\",\"role\":\"operator\",\"status\":\"active\"}', '2025-08-31 15:20:21'),
(31, 2, 'LOGOUT', 'users', 2, NULL, '', '2025-08-31 15:20:26'),
(32, 6, 'LOGIN_SUCCESS', 'users', 6, NULL, '', '2025-08-31 15:20:32'),
(33, 6, 'LOGOUT', 'users', 6, NULL, '', '2025-08-31 15:21:03'),
(34, 2, 'LOGIN_SUCCESS', 'users', 2, NULL, '', '2025-08-31 15:21:10'),
(35, 2, 'SET_STATUS', 'users', 5, NULL, '{\"status\":\"suspended\"}', '2025-08-31 15:22:15'),
(36, 2, 'LOGOUT', 'users', 2, NULL, '', '2025-08-31 15:22:19'),
(37, 5, 'LOGIN_SUCCESS', 'users', 5, NULL, '', '2025-08-31 15:22:25'),
(38, 5, 'LOGOUT', 'users', 5, NULL, '', '2025-08-31 15:22:41'),
(39, 2, 'LOGIN_SUCCESS', 'users', 2, NULL, '', '2025-08-31 15:22:48'),
(40, 2, 'RESET_PASSWORD', 'users', 6, NULL, '{\"reset_by\":2}', '2025-08-31 15:23:21'),
(41, 2, 'LOGOUT', 'users', 2, NULL, '', '2025-08-31 15:23:37'),
(42, 6, 'LOGIN_SUCCESS', 'users', 6, NULL, '', '2025-08-31 15:23:44'),
(43, 6, 'LOGOUT', 'users', 6, NULL, '', '2025-08-31 15:29:44'),
(44, 2, 'LOGIN_SUCCESS', 'users', 2, NULL, '', '2025-08-31 15:29:52'),
(45, 2, 'LOGIN_SUCCESS', 'users', 2, NULL, '', '2025-08-31 15:30:27'),
(46, 2, 'RESET_PASSWORD', 'users', 6, NULL, '{\"reset_by\":2}', '2025-08-31 15:31:23'),
(47, 2, 'LOGOUT', 'users', 2, NULL, '', '2025-08-31 15:31:30'),
(48, 5, 'LOGIN_FAIL', 'users', 5, NULL, '{\"ip\":\"::1\"}', '2025-08-31 15:31:36'),
(49, 6, 'LOGIN_SUCCESS', 'users', 6, NULL, '', '2025-08-31 15:31:44'),
(50, 6, 'LOGOUT', 'users', 6, NULL, '', '2025-08-31 15:32:25'),
(51, 2, 'LOGIN_SUCCESS', 'users', 2, NULL, '', '2025-08-31 15:32:32'),
(52, 2, 'LOGIN_SUCCESS', 'users', 2, NULL, '', '2025-08-31 15:34:22'),
(53, 2, 'LOGIN_SUCCESS', 'users', 2, NULL, '', '2025-08-31 15:38:33'),
(54, 2, 'SET_STATUS', 'users', 5, NULL, '{\"status\":\"active\"}', '2025-08-31 15:39:05'),
(55, 2, 'LOGOUT', 'users', 2, NULL, '', '2025-08-31 15:39:09'),
(56, 5, 'LOGIN_SUCCESS', 'users', 5, NULL, '', '2025-08-31 15:39:16'),
(57, 5, 'LOGOUT', 'users', 5, NULL, '', '2025-08-31 15:39:21'),
(58, 2, 'LOGIN_SUCCESS', 'users', 2, NULL, '', '2025-08-31 15:39:31'),
(59, 2, 'LOGIN_SUCCESS', 'users', 2, NULL, '', '2025-08-31 16:00:12'),
(60, 2, 'LOGIN_SUCCESS', 'users', 2, NULL, '', '2025-09-03 04:51:08'),
(61, 2, 'LOGIN_SUCCESS', 'users', 2, NULL, '', '2025-09-04 13:41:11'),
(62, 2, 'LOGIN_SUCCESS', 'users', 2, NULL, '', '2025-09-05 02:04:12'),
(63, 2, 'LOGIN_SUCCESS', 'users', 2, NULL, '', '2025-09-05 06:56:51'),
(64, 2, 'CREATE_SNAPSHOT', 'daily_snapshots', 1, NULL, '{\"date\":\"2025-09-05\"}', '2025-09-05 08:04:12'),
(65, 2, 'DELETE_SNAPSHOT', 'daily_snapshots', 1, '{\"snapshot_date\":\"2025-09-05\"}', '', '2025-09-05 08:12:44'),
(66, 2, 'CREATE_SNAPSHOT', 'daily_snapshots', 2, NULL, '{\"date\":\"2025-09-05\"}', '2025-09-05 08:14:20'),
(67, 2, 'DELETE_SNAPSHOT', 'daily_snapshots', 2, '{\"snapshot_date\":\"2025-09-05\"}', '', '2025-09-05 08:45:04'),
(68, 2, 'CREATE_SNAPSHOT', 'daily_snapshots', 3, NULL, '{\"date\":\"2025-09-05\"}', '2025-09-05 08:45:11'),
(69, 2, 'LOGIN_SUCCESS', 'users', 2, NULL, '', '2025-09-07 06:33:12'),
(70, 2, 'CREATE_SNAPSHOT', 'daily_snapshots', 4, NULL, '{\"date\":\"2025-09-07\"}', '2025-09-07 07:06:29'),
(71, 2, 'UPDATE_USER', 'users', 5, '{\"id\":5,\"username\":\"syarifadriann\",\"password_hash\":\"$argon2id$v=19$m=65536,t=4,p=1$ZXNxTG13SHB3amxRRmVWVw$Pcl0y73J9ZQ+o3oYUNI7Ev55WZGyds9BL8KjX56yIZQ\",\"role\":\"operator\",\"status\":\"active\",\"last_login_at\":null,\"must_change_password\":1,\"full_name\":\"syarif adrian mangaraja lubis\",\"email\":\"syarifadrian9@gmail.com\",\"is_active\":1,\"created_at\":\"2025-08-31 21:13:04\",\"updated_at\":\"2025-08-31 22:39:05\"}', '{\"id\":\"5\",\"csrf_token\":\"115ac200c47fe3a13a2f39123035719d0af08bbbaf16b14f322432667b7a6990\",\"full_name\":\"syarif adrian mangaraja lubis\",\"username\":\"syarifadriann\",\"email\":\"syarifadrian9@gmail.com\",\"role\":\"viewer\",\"status\":\"active\",\"password\":\"Admin@123\",\"action\":\"update\"}', '2025-09-07 07:39:30'),
(72, 2, 'LOGOUT', 'users', 2, NULL, '', '2025-09-07 07:39:34'),
(73, 5, 'LOGIN_SUCCESS', 'users', 5, NULL, '', '2025-09-07 07:39:41'),
(74, 5, 'LOGOUT', 'users', 5, NULL, '', '2025-09-07 07:40:20'),
(75, 2, 'LOGIN_SUCCESS', 'users', 2, NULL, '', '2025-09-07 07:40:25'),
(76, 2, 'DELETE_SNAPSHOT', 'daily_snapshots', 4, '{\"snapshot_date\":\"2025-09-07\"}', '', '2025-09-07 07:41:04'),
(77, 2, 'DELETE_SNAPSHOT', 'daily_snapshots', 3, '{\"snapshot_date\":\"2025-09-05\"}', '', '2025-09-07 07:41:08'),
(78, 2, 'CREATE_SNAPSHOT', 'daily_snapshots', 5, NULL, '{\"date\":\"2025-09-07\"}', '2025-09-07 07:41:15'),
(79, 2, 'CREATE_SNAPSHOT', 'daily_snapshots', 6, NULL, '{\"date\":\"2025-09-05\"}', '2025-09-07 07:43:49'),
(80, 2, 'DELETE_SNAPSHOT', 'daily_snapshots', 5, '{\"snapshot_date\":\"2025-09-07\"}', '', '2025-09-07 07:44:47'),
(81, 2, 'DELETE_SNAPSHOT', 'daily_snapshots', 6, '{\"snapshot_date\":\"2025-09-05\"}', '', '2025-09-07 07:44:51'),
(82, 2, 'CREATE_SNAPSHOT', 'daily_snapshots', 7, NULL, '{\"date\":\"2025-09-07\"}', '2025-09-07 07:44:52'),
(83, 2, 'CREATE_SNAPSHOT', 'daily_snapshots', 8, NULL, '{\"date\":\"2025-09-05\"}', '2025-09-07 07:45:12'),
(84, 2, 'UPSERT_SNAPSHOT', 'daily_snapshots', 0, NULL, '{\"date\":\"2025-09-07\"}', '2025-09-07 08:00:36'),
(85, 2, 'UPSERT_SNAPSHOT', 'daily_snapshots', 0, NULL, '{\"date\":\"2025-09-05\"}', '2025-09-07 08:00:42'),
(86, 2, 'UPSERT_SNAPSHOT', 'daily_snapshots', 0, NULL, '{\"date\":\"2025-09-05\"}', '2025-09-07 08:13:37'),
(87, 2, 'UPSERT_SNAPSHOT', 'daily_snapshots', 0, NULL, '{\"date\":\"2025-09-05\"}', '2025-09-07 08:15:10'),
(88, 2, 'UPSERT_SNAPSHOT', 'daily_snapshots', 0, NULL, '{\"date\":\"2025-09-07\"}', '2025-09-07 08:15:37'),
(89, 2, 'UPSERT_SNAPSHOT', 'daily_snapshots', 0, NULL, '{\"date\":\"2025-09-07\"}', '2025-09-07 08:23:38'),
(90, 2, 'UPSERT_SNAPSHOT', 'daily_snapshots', 0, NULL, '{\"date\":\"2025-09-05\"}', '2025-09-07 08:23:44'),
(91, 2, 'LOGIN_SUCCESS', 'users', 2, NULL, '', '2025-09-07 09:21:15'),
(92, 2, 'LOGIN_SUCCESS', 'users', 2, NULL, '', '2025-09-15 05:25:37'),
(93, 2, 'LOGIN_SUCCESS', 'users', 2, NULL, '', '2025-09-15 07:28:28'),
(94, 2, 'LOGIN_SUCCESS', 'users', 2, NULL, '', '2025-09-15 08:35:33'),
(95, 2, 'LOGIN_SUCCESS', 'users', 2, NULL, '', '2025-09-15 08:38:57'),
(96, 2, 'LOGIN_SUCCESS', 'users', 2, NULL, '', '2025-09-17 07:02:19'),
(97, 2, 'LOGIN_SUCCESS', 'users', 2, NULL, '', '2025-09-17 07:45:09'),
(98, 2, 'LOGIN_SUCCESS', 'users', 2, NULL, '', '2025-09-17 08:21:36'),
(99, 2, 'LOGIN_SUCCESS', 'users', 2, NULL, '', '2025-09-17 12:24:57'),
(100, 5, 'LOGIN_SUCCESS', 'users', 5, NULL, '', '2025-09-18 11:38:00'),
(101, 5, 'LOGIN_SUCCESS', 'users', 5, NULL, '', '2025-09-18 11:39:11'),
(102, 5, 'LOGIN_SUCCESS', 'users', 5, NULL, '', '2025-09-18 11:42:50'),
(103, 5, 'LOGIN_SUCCESS', 'users', 5, NULL, '', '2025-09-18 11:47:43'),
(104, 5, 'LOGIN_SUCCESS', 'users', 5, NULL, '', '2025-09-18 11:51:28'),
(105, 5, 'LOGIN_SUCCESS', 'users', 5, NULL, '', '2025-09-18 11:52:06'),
(106, 5, 'LOGIN_SUCCESS', 'users', 5, NULL, '', '2025-09-18 11:54:26'),
(107, 5, 'LOGIN_SUCCESS', 'users', 5, NULL, '', '2025-09-18 11:55:21'),
(108, 5, 'LOGIN_SUCCESS', 'users', 5, NULL, '', '2025-09-18 11:55:56'),
(109, 5, 'LOGIN_SUCCESS', 'users', 5, NULL, '', '2025-09-18 11:57:21'),
(110, 5, 'LOGIN_SUCCESS', 'users', 5, NULL, '', '2025-09-18 11:58:51'),
(111, 5, 'LOGIN_SUCCESS', 'users', 5, NULL, '', '2025-09-18 12:00:30'),
(112, 5, 'LOGIN_SUCCESS', 'users', 5, NULL, '', '2025-09-18 12:01:36'),
(113, 5, 'LOGIN_SUCCESS', 'users', 5, NULL, '', '2025-09-18 12:02:41'),
(114, 5, 'LOGIN_SUCCESS', 'users', 5, NULL, '', '2025-09-18 12:03:28'),
(115, 5, 'LOGIN_SUCCESS', 'users', 5, NULL, '', '2025-09-18 12:05:23'),
(116, 5, 'LOGIN_SUCCESS', 'users', 5, NULL, '', '2025-09-18 12:07:25'),
(117, 5, 'LOGIN_SUCCESS', 'users', 5, NULL, '', '2025-09-18 12:08:02'),
(118, 5, 'LOGIN_SUCCESS', 'users', 5, NULL, '', '2025-09-18 12:08:53'),
(119, 5, 'LOGIN_SUCCESS', 'users', 5, NULL, '', '2025-09-18 12:09:39'),
(120, 5, 'LOGIN_SUCCESS', 'users', 5, NULL, '', '2025-09-18 12:16:32'),
(121, 5, 'LOGIN_SUCCESS', 'users', 5, NULL, '', '2025-09-18 12:20:54'),
(122, 5, 'LOGIN_SUCCESS', 'users', 5, NULL, '', '2025-09-18 12:23:01'),
(123, 5, 'LOGIN_SUCCESS', 'users', 5, NULL, '', '2025-09-18 12:23:55'),
(124, 5, 'LOGIN_SUCCESS', 'users', 5, NULL, '', '2025-09-18 12:25:05'),
(125, 5, 'LOGIN_SUCCESS', 'users', 5, NULL, '', '2025-09-18 12:26:03'),
(126, 5, 'LOGIN_SUCCESS', 'users', 5, NULL, '', '2025-09-18 12:26:46'),
(127, 5, 'LOGIN_SUCCESS', 'users', 5, NULL, '', '2025-09-18 12:27:45'),
(128, 5, 'LOGIN_SUCCESS', 'users', 5, NULL, '', '2025-09-18 12:28:27'),
(129, 5, 'LOGIN_SUCCESS', 'users', 5, NULL, '', '2025-09-18 12:29:11'),
(130, 5, 'LOGIN_SUCCESS', 'users', 5, NULL, '', '2025-09-18 12:30:02'),
(131, 5, 'LOGIN_SUCCESS', 'users', 5, NULL, '', '2025-09-18 12:30:47'),
(132, 5, 'LOGIN_SUCCESS', 'users', 5, NULL, '', '2025-09-18 12:31:35'),
(133, 5, 'LOGIN_SUCCESS', 'users', 5, NULL, '', '2025-09-18 12:32:24'),
(134, 5, 'LOGIN_SUCCESS', 'users', 5, NULL, '', '2025-09-18 12:33:32'),
(135, 5, 'LOGIN_SUCCESS', 'users', 5, NULL, '', '2025-09-18 12:34:08'),
(136, 5, 'LOGIN_SUCCESS', 'users', 5, NULL, '', '2025-09-18 12:35:08'),
(137, 5, 'LOGIN_SUCCESS', 'users', 5, NULL, '', '2025-09-18 12:36:30'),
(138, 5, 'LOGIN_SUCCESS', 'users', 5, NULL, '', '2025-09-18 12:41:48'),
(139, 5, 'LOGIN_SUCCESS', 'users', 5, NULL, '', '2025-09-18 12:42:31'),
(140, 5, 'LOGIN_SUCCESS', 'users', 5, NULL, '', '2025-09-18 12:43:18'),
(141, 5, 'LOGIN_SUCCESS', 'users', 5, NULL, '', '2025-09-18 12:44:16'),
(142, 5, 'LOGIN_SUCCESS', 'users', 5, NULL, '', '2025-09-18 12:44:55'),
(143, 5, 'LOGIN_SUCCESS', 'users', 5, NULL, '', '2025-09-18 12:45:34'),
(144, 5, 'LOGIN_SUCCESS', 'users', 5, NULL, '', '2025-09-18 12:46:14'),
(145, 5, 'LOGIN_SUCCESS', 'users', 5, NULL, '', '2025-09-18 12:46:55'),
(146, 5, 'LOGIN_SUCCESS', 'users', 5, NULL, '', '2025-09-18 12:47:35'),
(147, 5, 'LOGIN_SUCCESS', 'users', 5, NULL, '', '2025-09-18 12:48:29'),
(148, 5, 'LOGIN_SUCCESS', 'users', 5, NULL, '', '2025-09-18 12:49:16'),
(149, 5, 'LOGIN_SUCCESS', 'users', 5, NULL, '', '2025-09-18 12:49:59'),
(150, 5, 'LOGIN_SUCCESS', 'users', 5, NULL, '', '2025-09-18 12:51:07'),
(151, 5, 'LOGIN_SUCCESS', 'users', 5, NULL, '', '2025-09-18 12:51:39'),
(152, 5, 'LOGIN_SUCCESS', 'users', 5, NULL, '', '2025-09-18 12:52:41'),
(153, 5, 'LOGIN_SUCCESS', 'users', 5, NULL, '', '2025-09-18 12:55:28'),
(154, 5, 'LOGIN_SUCCESS', 'users', 5, NULL, '', '2025-09-18 12:56:16'),
(155, 5, 'LOGIN_SUCCESS', 'users', 5, NULL, '', '2025-09-18 12:58:35'),
(156, 5, 'LOGIN_SUCCESS', 'users', 5, NULL, '', '2025-09-18 12:59:50'),
(157, 5, 'LOGIN_SUCCESS', 'users', 5, NULL, '', '2025-09-18 13:00:32'),
(158, 5, 'LOGIN_SUCCESS', 'users', 5, NULL, '', '2025-09-18 13:01:13'),
(159, 5, 'LOGIN_SUCCESS', 'users', 5, NULL, '', '2025-09-18 13:01:54'),
(160, 5, 'LOGIN_SUCCESS', 'users', 5, NULL, '', '2025-09-18 13:02:24'),
(161, 5, 'LOGIN_SUCCESS', 'users', 5, NULL, '', '2025-09-18 13:03:06'),
(162, 2, 'LOGIN_SUCCESS', 'users', 2, NULL, '', '2025-09-18 13:03:45'),
(163, 5, 'LOGIN_SUCCESS', 'users', 5, NULL, '', '2025-09-18 13:03:48'),
(164, 5, 'LOGIN_SUCCESS', 'users', 5, NULL, '', '2025-09-18 13:04:34'),
(165, 5, 'LOGIN_SUCCESS', 'users', 5, NULL, '', '2025-09-18 13:05:12'),
(166, 5, 'LOGIN_SUCCESS', 'users', 5, NULL, '', '2025-09-18 13:12:23'),
(167, 2, 'LOGIN_SUCCESS', 'users', 2, NULL, '', '2025-09-19 03:52:31'),
(168, 2, 'LOGIN_SUCCESS', 'users', 2, NULL, '', '2025-09-19 15:04:38'),
(169, 2, 'LOGOUT', 'users', 2, NULL, '', '2025-09-19 15:04:56'),
(170, 2, 'LOGIN_SUCCESS', 'users', 2, NULL, '', '2025-09-19 15:04:58'),
(171, 2, 'LOGIN_SUCCESS', 'users', 2, NULL, '', '2025-09-19 15:10:09'),
(172, 2, 'LOGIN_SUCCESS', 'users', 2, NULL, '', '2025-09-20 00:15:02'),
(173, 2, 'LOGIN_SUCCESS', 'users', 2, NULL, '', '2025-09-20 01:46:53'),
(174, 2, 'LOGIN_SUCCESS', 'users', 2, NULL, '', '2025-09-20 04:50:14'),
(175, 2, 'LOGIN_SUCCESS', 'users', 2, NULL, '', '2025-09-20 06:19:03'),
(176, 2, 'UPSERT_SNAPSHOT', 'daily_snapshots', 0, NULL, '{\"date\":\"2025-09-20\"}', '2025-09-20 06:52:58'),
(177, 2, 'LOGOUT', 'users', 2, NULL, '', '2025-09-20 08:26:39'),
(178, 3, 'LOGIN_FAIL', 'users', 3, NULL, '{\"ip\":\"::1\"}', '2025-09-20 08:27:12'),
(179, 2, 'LOGIN_SUCCESS', 'users', 2, NULL, '', '2025-09-20 08:28:17'),
(180, 2, 'LOGIN_SUCCESS', 'users', 2, NULL, '', '2025-09-20 12:39:04'),
(181, 2, 'LOGIN_SUCCESS', 'users', 2, NULL, '', '2025-09-20 13:07:44'),
(182, 2, 'LOGOUT', 'users', 2, NULL, '', '2025-09-20 15:04:18'),
(183, 7, 'LOGIN_SUCCESS', 'users', 7, NULL, '', '2025-09-20 15:04:27'),
(184, 7, 'LOGOUT', 'users', 7, NULL, '', '2025-09-20 15:05:55'),
(185, 2, 'LOGIN_SUCCESS', 'users', 2, NULL, '', '2025-09-20 15:06:01'),
(186, 2, 'LOGOUT', 'users', 2, NULL, '', '2025-09-20 15:13:49'),
(187, 9, 'LOGIN_FAIL', 'users', 9, NULL, '{\"ip\":\"::1\"}', '2025-09-20 15:13:58'),
(188, 9, 'LOGIN_FAIL', 'users', 9, NULL, '{\"ip\":\"::1\"}', '2025-09-20 15:14:09'),
(189, 9, 'LOGIN_SUCCESS', 'users', 9, NULL, '', '2025-09-20 15:14:15'),
(190, 9, 'LOGOUT', 'users', 9, NULL, '', '2025-09-20 15:16:39'),
(191, 7, 'LOGIN_FAIL', 'users', 7, NULL, '{\"ip\":\"::1\"}', '2025-09-20 15:16:44'),
(192, 2, 'LOGIN_SUCCESS', 'users', 2, NULL, '', '2025-09-20 15:16:53'),
(193, 2, 'LOGOUT', 'users', 2, NULL, '', '2025-09-20 15:18:02'),
(194, 7, 'LOGIN_SUCCESS', 'users', 7, NULL, '', '2025-09-20 15:18:10'),
(195, 7, 'LOGOUT', 'users', 7, NULL, '', '2025-09-20 15:18:31'),
(196, 9, 'LOGIN_SUCCESS', 'users', 9, NULL, '', '2025-09-20 15:18:37'),
(197, 5, 'LOGIN_SUCCESS', 'users', 5, NULL, '', '2025-09-24 04:19:12'),
(198, 5, 'LOGOUT', 'users', 5, NULL, '', '2025-09-24 04:20:45'),
(199, 2, 'LOGIN_SUCCESS', 'users', 2, NULL, '', '2025-09-24 04:21:06'),
(200, 2, 'LOGIN_SUCCESS', 'users', 2, NULL, '', '2025-09-24 04:21:07'),
(201, 2, 'LOGIN_SUCCESS', 'users', 2, NULL, '', '2025-10-02 10:50:11'),
(202, 2, 'LOGOUT', 'users', 2, NULL, '', '2025-10-02 10:59:20'),
(203, 2, 'LOGIN_SUCCESS', 'users', 2, NULL, '', '2025-10-02 11:08:33'),
(204, 2, 'LOGIN_SUCCESS', 'users', 2, NULL, '', '2025-10-03 03:58:28'),
(205, 2, 'LOGOUT', 'users', 2, NULL, '', '2025-10-03 04:09:22'),
(206, 2, 'LOGIN_SUCCESS', 'users', 2, NULL, '', '2025-10-03 04:09:32'),
(207, 2, 'CREATE_USER', 'users', 10, NULL, '{\"username\":\"ATC\",\"email\":\"atc@gmail.com\",\"role\":\"viewer\",\"status\":\"active\"}', '2025-10-03 04:10:57'),
(208, 2, 'LOGOUT', 'users', 2, NULL, '', '2025-10-03 04:11:21'),
(209, 10, 'LOGIN_SUCCESS', 'users', 10, NULL, '', '2025-10-03 04:11:29'),
(210, 10, 'LOGOUT', 'users', 10, NULL, '', '2025-10-03 04:12:29'),
(211, 2, 'LOGIN_SUCCESS', 'users', 2, NULL, '', '2025-10-03 04:12:33'),
(212, 2, 'UPSERT_SNAPSHOT', 'daily_snapshots', 0, NULL, '{\"date\":\"2025-10-03\"}', '2025-10-03 04:12:52'),
(213, 2, 'LOGIN_SUCCESS', 'users', 2, NULL, '', '2025-10-20 10:36:20'),
(214, 2, 'LOGIN_SUCCESS', 'users', 2, NULL, '', '2025-10-20 10:39:11'),
(215, 2, 'LOGIN_SUCCESS', 'users', 2, NULL, '', '2025-10-24 18:27:53'),
(216, 2, 'LOGOUT', 'users', 2, NULL, '', '2025-10-24 18:28:29'),
(217, 10, 'LOGIN_SUCCESS', 'users', 10, NULL, '', '2025-10-24 18:30:27'),
(218, 10, 'LOGIN_SUCCESS', 'users', 10, NULL, '', '2025-10-24 18:31:22'),
(219, 10, 'LOGIN_SUCCESS', 'users', 10, NULL, '', '2025-10-24 18:39:16'),
(220, 10, 'LOGIN_SUCCESS', 'users', 10, NULL, '', '2025-10-24 18:40:34'),
(221, 10, 'LOGIN_SUCCESS', 'users', 10, NULL, '', '2025-10-24 18:40:44'),
(222, 10, 'LOGIN_SUCCESS', 'users', 10, NULL, '', '2025-10-24 18:43:42'),
(223, 10, 'LOGIN_SUCCESS', 'users', 10, NULL, '', '2025-10-24 18:47:10'),
(224, 10, 'LOGIN_SUCCESS', 'users', 10, NULL, '', '2025-10-24 18:47:27'),
(225, 10, 'LOGIN_SUCCESS', 'users', 10, NULL, '', '2025-10-24 18:49:39'),
(226, 1, 'LOGIN_SUCCESS', 'users', 1, NULL, '', '2025-10-25 12:57:25'),
(227, 6, 'LOGIN_SUCCESS', 'users', 6, NULL, '', '2025-10-25 12:57:29'),
(228, 1, 'LOGIN_SUCCESS', 'users', 1, NULL, '', '2025-10-25 12:57:38'),
(229, 6, 'LOGIN_SUCCESS', 'users', 6, NULL, '', '2025-10-25 12:58:11'),
(230, 6, 'LOGIN_SUCCESS', 'users', 6, NULL, '', '2025-10-25 12:58:19'),
(231, 6, 'LOGIN_SUCCESS', 'users', 6, NULL, '', '2025-10-25 13:13:06'),
(232, 6, 'LOGIN_SUCCESS', 'users', 6, NULL, '', '2025-10-25 13:13:54'),
(233, 6, 'LOGIN_SUCCESS', 'users', 6, NULL, '', '2025-10-25 13:14:30'),
(234, 6, 'LOGIN_SUCCESS', 'users', 6, NULL, '', '2025-10-25 13:14:48'),
(235, 6, 'LOGIN_SUCCESS', 'users', 6, NULL, '', '2025-10-25 13:15:13'),
(236, 6, 'LOGIN_SUCCESS', 'users', 6, NULL, '', '2025-10-25 13:15:40'),
(237, 6, 'LOGIN_SUCCESS', 'users', 6, NULL, '', '2025-10-25 13:46:46'),
(238, 6, 'LOGIN_SUCCESS', 'users', 6, NULL, '', '2025-10-25 13:47:27'),
(239, 6, 'LOGOUT', 'users', 6, NULL, '', '2025-10-25 13:53:46'),
(240, 2, 'LOGIN_SUCCESS', 'users', 2, NULL, '', '2025-10-25 13:53:48'),
(241, 6, 'LOGIN_SUCCESS', 'users', 6, NULL, '', '2025-10-25 14:15:02'),
(242, 6, 'LOGIN_SUCCESS', 'users', 6, NULL, '', '2025-10-25 14:32:17'),
(243, 2, 'LOGIN_SUCCESS', 'users', 2, NULL, '', '2025-10-26 05:59:48'),
(244, 2, 'LOGIN_SUCCESS', 'users', 2, NULL, '', '2025-10-26 06:35:43'),
(245, 11, 'LOGIN_SUCCESS', 'users', 11, NULL, '', '2025-10-26 06:50:30'),
(246, 2, 'LOGIN_SUCCESS', 'users', 2, NULL, '', '2025-10-27 07:14:16'),
(247, 2, 'LOGIN_SUCCESS', 'users', 2, NULL, '', '2025-10-28 07:32:23'),
(248, 2, 'LOGIN_SUCCESS', 'users', 2, NULL, '', '2025-10-30 07:22:54'),
(249, 2, 'LOGIN_SUCCESS', 'users', 2, NULL, '', '2025-10-30 12:02:50'),
(250, 2, 'LOGOUT', 'users', 2, NULL, '', '2025-10-30 12:26:51'),
(251, 2, 'LOGIN_SUCCESS', 'users', 2, NULL, '', '2025-10-30 12:31:10'),
(252, 2, 'LOGIN_SUCCESS', 'users', 2, NULL, '', '2025-11-04 07:39:07'),
(253, 2, 'LOGIN_SUCCESS', 'users', 2, NULL, '', '2025-11-05 06:42:31');

-- --------------------------------------------------------

--
-- Table structure for table `daily_snapshots`
--

CREATE TABLE `daily_snapshots` (
  `id` bigint(20) UNSIGNED NOT NULL,
  `snapshot_date` date NOT NULL,
  `snapshot_data` longtext NOT NULL COMMENT 'JSON-encoded snapshot data',
  `created_by_user_id` bigint(20) UNSIGNED NOT NULL,
  `created_at` timestamp NULL DEFAULT current_timestamp()
) ENGINE=InnoDB DEFAULT CHARSET=utf8mb4 COLLATE=utf8mb4_unicode_ci;

--
-- Dumping data for table `daily_snapshots`
--

INSERT INTO `daily_snapshots` (`id`, `snapshot_date`, `snapshot_data`, `created_by_user_id`, `created_at`) VALUES
(7, '2025-09-07', '{\"staff_roster\":[],\"movements\":[{\"id\":60,\"registration\":\"PK-GJV\",\"aircraft_type\":\"ATR 72\",\"on_block_time\":\"02:04 (07\\/09\\/2025)\",\"off_block_time\":null,\"parking_stand\":\"WR01\",\"from_location\":\"WAHH\",\"to_location\":\"\",\"flight_no_arr\":\"QG 1101\",\"flight_no_dep\":\"\",\"operator_airline\":\"CITILINK\",\"remarks\":\"\",\"is_ron\":1,\"ron_complete\":0,\"movement_date\":\"2025-09-07\",\"user_id_created\":2,\"user_id_updated\":2,\"created_at\":\"2025-09-07 14:05:45\",\"updated_at\":\"2025-09-07 15:14:53\",\"on_block_date\":\"2025-09-07\",\"off_block_date\":null,\"category\":\"commercial\",\"aircraft_operator\":\"CITILINK\"}],\"ron_data\":[{\"id\":60,\"registration\":\"PK-GJV\",\"aircraft_type\":\"ATR 72\",\"on_block_time\":\"02:04 (07\\/09\\/2025)\",\"off_block_time\":null,\"parking_stand\":\"WR01\",\"from_location\":\"WAHH\",\"to_location\":\"\",\"flight_no_arr\":\"QG 1101\",\"flight_no_dep\":\"\",\"operator_airline\":\"CITILINK\",\"remarks\":\"\",\"is_ron\":1,\"ron_complete\":0,\"movement_date\":\"2025-09-07\",\"user_id_created\":2,\"user_id_updated\":2,\"created_at\":\"2025-09-07 14:05:45\",\"updated_at\":\"2025-09-07 15:14:53\",\"on_block_date\":\"2025-09-07\",\"off_block_date\":null,\"category\":\"commercial\"}],\"daily_metrics\":{\"total_arrivals\":1,\"total_departures\":0,\"new_ron\":1,\"active_ron\":18,\"hourly_movements\":[{\"time_range\":\"02:00-03:59\",\"Arrivals\":\"1\",\"Departures\":\"0\"}],\"snapshot_generated_at\":\"2025-09-07 10:23:38\"}}', 2, '2025-09-07 07:44:52'),
